Date,Rating,Message,Author Reviews,Restaurant
2024-10-11,3.0,"I'd eaten here previously during my last visit about one year ago. I came to visit the Rotunda at the U of V, however due to traffic arrived at about 5:30pm by which time the door were closed. I was hungry and it was a gorgeous day, so I chose to eat outdoor at the Virginian. I was seated promptly and provided spirited libations. I decided  on something not too heavy so settled on the Hummus Platter. Maggie was as attentive as possible considering how busy it was, largely of collegiate. I filled up fairly quickly, enjoyed the sights, and took pics for you.i really can't comment on how it looked inside as it was too pretty to sit indoors. Having been there twice now, I might look for someplace else next time for a change.",121.0,Virginian
2024-10-17,5.0,"This place looks, feels, and is quite old.

It's is the quintessential college sports bar/restaurant. The place is incredibly small on the inside with almost no seating for parties larger than 4 people. 

The food was quite good. I really enjoyed the Mac and cheese app with a potato cake on top. While my club sandwich was not all that great it may have been more due to the fact I'm not a big club sandwich guy. I just fall for ""famous *insert name of restaurant*"" every time I see it on the menu.

I heard from a little birdie the burger was quite good so that would likely be my next option. Fries were spectacular though. An incredible amount of seasoning was added... which always gets bonus points for me. 

The workers here are comprised of most college aged individuals and they were extremely polite, efficient, and knowledgeable. 

Would recommend.",140.0,Virginian
2024-11-04,5.0,"When visiting UVA for a college tour, be sure to stop in for a bite at The Virginian Restaurant. 

My son and I enjoyed a Cobb salad and classic pimento cheese sandwich. The pimento cheese was creamy and spicy, just the way it's meant to be!

The restaurant offers something for everyone. It's a landmark that shouldn't be missed!",13.0,Virginian
2024-11-13,3.0,"Pretty good happy hour deals (Monday - Thursday 3-7PM). If you're seated at the bar you get 50% off apps, and I believe the drink specials are throughout the restaurant, with some extra drink deals each day.

Now, for the food: we tried the chicken quesadilla, spinach & artichoke dip, mac n' cheese, and french onion soup. My favorites were the french onion soup and mac n cheese (it's topped with a cheddar potato cake which elevates it). I'd also recommend the chicken quesadilla for bang for your buck, but it was a little dry. 

Bonus tip: there are hooks under the bar to hang jackets/purses!",362.0,Virginian
2008-06-12,1.0,"Eh?

I went to college in Charlottesville, VA.  Now, we like to eat down in cville.  I was back in town for a wedding and the rehearsal dinner was there.  
Let me start with the good stuff.  
-Service: They have good service.  They cleared plates and filled drinks fast. They were attentive but not overly hovering.  We had a big group of people but the food came out fairly quick. 
-Cost: Eh.   a little more pricier than most. But, not bad. I'm not sure how much the food actually lives up the place though.

Oh.. wait i'm already going into the bad stuff:
-Food: Dude, seriously the most important thing.  I ordered... Piccata di Pollo con Limone.. aka. Chicken Piccata. It comes with spaghetti in a similar sauce. Honestly, the chicken part of the dish was really good. However... God, I hate spaghetti.  It tasted like plain spaghetti.   Vitello alla Parmigiana  aka Veal Parmagean.... ditto. meat good. bad pasta.  

The salads were okay. You really have to be stupid to mess up salad. 
The ice-cream dessert was okay. Ditto on the stupid thing.
The appetizers... calamari was good. Not overly greasy.  And the bruschetta appetizer was pretty good as well.  

I feel... they fall short.  They have a decent atmosphere... you can watch movies outside and eat dinner, good tablescape and dishes, etc.  The bathroom was so hot, I don't know why they don't have ac in there.  

But, yes.. back to the food. I feel like I'm avoiding it.  

Here's the gist:

If you are a poor college student or your car breaks down in front of the restaurant... then you can go.  If not... go anywhere else. Go downtown ... it's only a few minutes away.  Honestly... I'm a little unimpressed.  apathetic, really.... kind of place where you don't take the leftovers home, but leave it there. 

Sorry, Vivace, better luck next time. 
I change my rating to a 1.",491.0,Vivace
2016-07-20,4.0,"I have been to Vivace three times and each time I had a nice experience.  Vivace has a lovely building that actually feels a lot like Europe.  I have dined both inside and outside and their outdoor patio is absolutely beautiful.  

I have always had good service at Vivace and good food to boot.  Because of my food allergies I am unable to eat most Italian food but they've been able to tweak the menu to allow me to dine and the food has always been excellent.  The drink menu is expansive and they have a lot of really nice wines.  

Vivace is a little off the beaten path if you're used to dining in the downtown area, like I am, but that makes it nice because it actually has parking!  They tend to fill up on the weekends so be sure to call ahead and make a reservation if you're going in on a Friday or Saturday evening.",693.0,Vivace
2017-11-04,3.0,Nice setting. Our food was just OK. Was a busy night and Service was not very good at all. With all the other restaurants to try in the area I cannot for see us coming back to this one.,59.0,Vivace
2017-12-23,4.0,"The food at Vivace is still delicious!! I recommend the gnocchi, tenderloin, and calamari. 

I love coming here, but there's still occasionally small things that crop up like the occasional dirty cup/utensils/bread bowl.",125.0,Vivace
2018-05-04,3.0,"I wanted to love this place. and for the most part I did... but the service was all over the place and the food was just OK the evening we went. we had a 10-person party tucked away in a private room, which was great.

our servers were so in the weeds they didn't seem to enjoy what they were doing. also, my chicken piccata was extremely bland and uninteresting, and the chicken was not pounded out the way it should be.

I'd like to go back on a night that isn't so slammed and try again.",479.0,Vivace
2018-10-05,4.0,"We came here on my birthday. We had a lovely time and great food! Service was decent but very pleasant. The lasagna and baked penne are delicious, and the spaghetti and meatballs was good, though the meatballs were a bit over cooked. All in all , we very much enjoyed the experience.",19.0,Vivace
2018-12-27,5.0,"We had a wonderful meal here and overall a fantastic experience! Everything was absolutely amazing!!  Had the wedge salad and it was perfect-crispy and accented with pancetta and accompanied by a very well done blue cheese dressing! The standard all wedge salads should strive for!  I had the lasagna bolognese and it was a huge portion! I had to take part of it home for dinner the next day-my husband had the chicken parmigiana and it was perfectly done-crispy and tender, just the way you hope it would be! It also came with a huge portion of spaghetti which will be lunch for tomorrow! We will be definitely be back here again soon!",469.0,Vivace
2019-01-01,4.0,"Pretty good and the atmosphere of the restaurant seemed nice though we just got takeout. I got broccoli and chicken alfredo and was impressed more by the broccoli and chicken than the pasta itself but overall it was good. The bread they sent with us though, paid for the whole meal. With butter it was delicious.",14.0,Vivace
2019-03-17,2.0,"We were visiting Charlottesville, VA this past weekend. 
Our waiter was not friendly and didn't come back around much and even when he did, he would forget what we asked for. The food was just ok. Save your $$ for another Italian restaurant in the area!",1.0,Vivace
2019-06-22,4.0,This place has great Italian food and we really enjoyed our experience - just go here to eat it's great,31.0,Vivace
2019-08-26,5.0,"We had a wonderful 50th anniversary celebration for our family in the Red Room. The service was excellent, food delicious and we are so appreciate everything that Landon, the owner, did to accommodate and welcome us! We already knew Vivace's great reputation, but this event was even more special for us and it would not have been so perfect without the efforts by the folks there. Thank you all!",6.0,Vivace
2019-09-20,5.0,"Great service, friendly staff. Me and my girlfriend really enjoy our dinner. We had calamari, gnocchi and carbonara. All were delicious!!!!",240.0,Vivace
2019-09-28,2.0,"The ambiance is great but my beer came out and felt like it was just placed into the fridge, only half cold. The water was much more cold than my it.  The bread tasted good but also seemed like it was not fresh like it had been sitting for a while.    

For better bread and food I prefer Olive Garden.",8.0,Vivace
2019-10-21,5.0,"This was the best Italian food I have had anywhere in the US thus far. It's legit, starting with the most amazing bread. The Bolognese with house made tagliatelle was amazing. I'd eat it again right now for breakfast.",29.0,Vivace
2019-11-03,1.0,"You can have all the great stuff to offer but if your service is bad it ruins everything! 

This has happened about 3-4 times now. They have some people working here with the worst attitude and have no problems being plain rude to you on your face. They advertise that they offer take out orders but have no patience to take down the takeout order and talk to you like you are not welcome there.

This one night my wife was trying to order a takeout from this place and the gentleman who answered the phone basically said to her in the middle of the conversation ""Ma'am, you are really trying me tonight!"". All because my wife asked to add some pesto sauce to their pasta primavera. My wife had to cancel the order because he was not interested to take the order at all, and he was very OK with it. 

The first couple times we gave the benefit of the doubt to them thinking that they might be busy, but after this time we are pretty much done here. Way to lose your regular customers! 

The front desk of the dining hall in my college was much more courteous and polite than this restaurant which is dependent on customers like us to be in business.",11.0,Vivace
2020-01-24,4.0,"A great Italian place! It's a nice romantic place. There's a lot of parking. Great service, and the food arrived quickly. There's nice outdoor seating, but it was winter so we wereet  able to check  it out.",400.0,Vivace
2020-02-29,1.0,"The worst service and the RUDEST waitress I've ever had. We had a reservation for a 9 top so it wasn't a surprise we were coming. It's so sad bc the food was delicious. Wanted to come back again but will not. 

We had a horrible time waiting for beverages and when we asked nicely for help , even the manager was completely rude and out of hand. It was a nightmare. They also added a 20% gratuity which is not seen often. It was ridiculous.",2.0,Vivace
2020-04-07,5.0,"Enjoyed our only delivery meal in the Covid-19 outbreak from Vivace.  The chicken marsala and gluten-free pasta were excellent. The shrimp pasta (also gluten free) was perfect.  But, the best thing was the humanity.  The over-phone service and the delivery person were incredible.  Thanks Vivace!  Keep it up!
And thanks Virginia for allowing wine delivery.",74.0,Vivace
2020-04-23,5.0,"Probably our fave Italian restaurant in Cville. Everything we've had is delicious. I love the ambiance too. Perfect for date night, girls night, or family night.",165.0,Vivace
2020-05-26,5.0,"AMAZING! The phone did not eat first tonight. Authentic Italian comfort food. I tried the eggplant parmesan, but I typically get the wedge salad and a side of bolognese because the sides are big enough for an entree! Cville favorite with the outdoor patio and intimate eating areas. Highly recommend!",67.0,Vivace
2020-08-09,5.0,"Our first visit. Knowledgeable wait staff with good recommendations. Bread/oil/cheese, excellent. 
Fried oysters and Meatball appetizers very tasty. 
Entree and desert suggestions were good choices. 
Overall quality experience, we'll definitely be back!",1.0,Vivace
2020-09-07,3.0,"Tried calling but voice mail said they were open every day except 4th of July.
Looking online said it was open until 9pm.
Wasted Uber ride to and form hotel as they were closed.
Update your messages!",14.0,Vivace
2020-10-26,4.0,"Not the greatest food but plentiful outdoor seating within the city of Charlottesville. From the road, you would not expect Vivace to sprawl as much as it does, but there are plenty of outdoor tables which make Vivace an excellent dining choice during the pandemic. We ordered the artichoke and goat cheese dip, orecchiette, and a spaghetti dish with clams that I could not find on the online menu. Shortly after we arrived, warm bread was brought out with individual salt and pepper packets, a small bowl of olive oil, and a small bowl of Parmesan cheese. The artichoke dip was served piping hot and was quite tasty if a little too salty for my taste. Our entrees were served in massive portions and we were only able to eat half of our respective dishes. The clams were fresh and the rest of the dish was quite acceptable. The sauce of orecchiette was somewhat watery and bland, but the pasta itself was cooked perfectly and fresh basil was delectable. Overall, I would recommend Vivace, but I will try a different dish if I return.",674.0,Vivace
2020-11-05,3.0,"At first glance, I thought this spot had more of a fine dining vibe, but it's more tacky than anything with painted curtains on the walls, plastic table cloths that are coming off its staples, and water spot stains on the ceilings. We arrived shortly after they opened for dinner, with about 2 other deuce tables upstairs other than us - yet service was quite slow- it took us awhile to get greeted and have waters, get our drink orders, etc. Then, the oil was brought out for bread, but we didn't get bread until we got our entrees. The bruschetta was classic and simple, yet tasty- it came with mozzarella cheese melted in between the toast and tomato. The calamari was also crunchy and tender, the fried peppers tossed in were a nice touch- just wish there were some tentacles mixed in with the rings! For dinner, we shared the prosciutto and arugula pizza and the orecchiette pasta. The pizza was disappointing, the crust was undercooked so each bite was soggy and I think there could have been more cheese! The pasta dish was the star, the homemade sausage was delightful in every bite!",437.0,Vivace
2020-11-30,5.0,"We had Vivace for the first time today and LOVED our meal. The Chicken parm was done so incredibly well, and there was a perfect balance of cheese on top to where it was not overpowering, and you could taste the sauce. We also ordered the Spaghetti Carbonara and thought it was equally great. Thanks, Vivace for such a great meal, complimentary bread, and also the best customer service!",4.0,Vivace
2021-01-21,5.0,"Outstanding service, quality food and homemade pasta, where could you go wrong!!  I had Ragu and tagallatelle (sp?), my friends ordered Chicken Parm w/pasta and a chicken and pasta, they were Borge very pleased with the their meals.  Salad was fresh, nice house dressing and very attentive service from our primary and secondary servers.  Can't wait to take my wife for dinner!!",121.0,Vivace
2021-02-15,5.0,"First timer tonight and the food was nothing short of delectable! We had bruschetta, ravioli, chicken Piccata, caesar salad, tiramisu, a Moscow mule and flirtini. Every last bit was so delicious. The bread and olive oil were so good I was almost full by the time we got our appetizer 
The food came in a timely manner and the waitresses were friendly and attentive. 
We did have an outdoor/tent reservation made well in advance, not knowing it was going to be 35 degrees out, as did a few others, and my only suggestion would be to have better heaters in those areas. I did not feel them at all and my legs were cold through my pants. I really felt for 2 of the ladies wearing skirts/dresses! 
As it was my first time eating here and we were not inside, I cannot speak to the indoor atmosphere but other than being a bit chilly, I very much enjoyed the food and staff and based on those would highly recommend for an amazing meal! Great for special occasions like today!",144.0,Vivace
2021-02-17,3.0,"Used to love this spot and have always had a great experience, especially the service. However, the outdoor ambiance is just not doing it for me right now. The inside has always had a traditional feel to it, however, I think it could use some updating. I loved the appetizers I had, but was not a huge fan of the Ragu alla Bolognese Pasta (not pictured here). It tasted like tomato sauce from a can and something I could make at home. If I do return, I will definitely be trying something new or getting the Carbonara or pizza again. They also serve massive portions which I love and hate at the same time. I always leave very content and full, but sometimes even to the point where I feel gross. Honestly a great place to get take out pizza though! Can't go wrong with that:)",34.0,Vivace
2021-04-08,5.0,wine and bread was fabulous start.  Great flavors.  Awesome food.  Great service.  Thank you!,13.0,Vivace
2021-04-18,4.0,"Since we are now vaccinated we are starting to go out again and looking forward to going to old favorites, and trying new experiences.  

We have done taken out from Vivace several times during Covid, and visited a couple of months ago and ate outside. This time we decided to eat inside and everything was great. Recognized our reservation, sat us immediately, and the service was all that you would expect and require.  Food was excellent and the timing of appetizers and the meal was good, especially since we knew that it is important for them to turn tables since we are still at 50% capacity.  

Only negative is parking.  I had to circle twice before I parked in a really tight spot on a hill.  On one side UVA is putting up a new building so there is a chain link fence that limits parking, and on the other side there is a strip of stores and since it was a Sunday we thought we could park in the empty lot. However, they had a part-time security guard who politely told us this was off-limits. Seems the ownership of the strip mall is not very supportive of Vivace.  We did find a spot, but when it gets back to 100% capacity I can imagine that parking is going to be a big problem for them.

All-in-all great night out with excellent service and food. Would strongly recommend making a reservation and heading out to the outdoor seating area as the weather warms.",14.0,Vivace
2021-04-26,5.0,"Stellar Italian food that will hit the spot. Pizza, pasta, salads, they do it all. Drinks are great as well, and the service is a little slow but it's an experience. They vibes inside the restaurant are very homey like you're in an Italian village, super cute!",80.0,Vivace
2021-04-27,5.0,Super delicious! Great atmosphere with amazing patio seating. Also had penne primavera which was super well done.,10.0,Vivace
2021-05-23,3.0,"Based on the food, 4 stars for sure. But the service is just so slow and if they're short staffed every time I'm there, then it's clearly a problem with restaurant management. I'll still likely order out from there but idk if I can dine in again with the service",157.0,Vivace
2021-05-28,4.0,The food and service was excellent as were the servers however asking diners to limit their dining time to 2 hrs. was unnerving. When it was 10 minutes to their required exit time we were reminded kindly about the time restrictions. After spending $60 I think I will choose to go somewhere where I can relax.,13.0,Vivace
2021-05-31,5.0,Beautiful location. I would recommend the outdoor patio. Servings are generously sized and taste great,33.0,Vivace
2021-07-18,1.0,Waited one and half hours for dinner to arrive at table. Then waited another 1/2 for desert menu. Food below average.,3.0,Vivace
2021-08-09,2.0,"We went for dinner here on a Sunday night, about an hour before close. The bread served was good, tasted crusty and fresh and worked really well with the olive oil. We ordered three entrees, the gnocchi, carbonara, and the pizza margherita. The pizza was the best of our entrees, it had a great crisp and char that tasted really authentic, if we come back that'll definitely be ordered again. The gnocchi was solid but not excellent, the spinach cream sauce was a very liquid-y cream sauce with some cooked spinach in it. The carbonara had the same problem of very liquid-y sauce. The pastas still tasted pretty good, just weren't the texture we were expecting from the descriptions in the menu. 

The staff was not particularly kind to us when we entered, we asked for a table for three and the staff asked us to wait a moment (which is more than fine), and while we waited they talked amongst themselves. We tried a few times to ask quick questions and were ignored and eventually told to seat ourselves. After we sat down most of the staff sat at the bar and we were able to hear them speaking negatively about customers who had just left the restaurant, which created an uncomfortable atmosphere. This really affected the course of our meal, and made me feel uncomfortable at the idea of returning. I would like to go back another day and hopefully have a different experience.",452.0,Vivace
2021-08-13,5.0,"After a day of exploring the area, we ended the night with a drive through the University and decided to stop in for dinner! Beautiful entrance into the restaurant under a tree as well as the outside dining area. Luckily due to the rain through tour the day, We got into the restaurant without a reservation. We were sat quickly. Service was friendly, quick and the server had great timing. I enjoyed the bruschetta with a peach tree cocktail. Perfect amount of everything for a fresh and delicious bruschetta. My friend enjoyed the fried oysters (which were delicious) and the bruetta with a cosmo. 

Hope to be back the next time I'm in town!",53.0,Vivace
2021-08-19,5.0,"Finally made my way over to Vivace after hearing from a couple of you guys about the food. Y'all really put me on! Got a couple of martinis since that was their specialty and they were smooth, crisp and a little strong but not a bad price at $10. We ordered the calamari as an app ($12) and the orecchiette ($22) as my entree. The sauce was packed with the savory house made sausage and broccoli rabe. It was so delicious, full of umami and the serving was quite large. The sauce filled up the little pockets in the pasta and the ratio of sauce to carb, was perfect for me.

I think I've found one of my new favorite places, so thank you so much for the recommendation! The food was delicious and well priced. Not overly expensive for a nice meal, great ingredients and the service was really good, our waitress was knowledgeable and really made a positive difference.

We sat on the upper patio, but next time we go, we will request the bistro seating which is outdoors and near a large willow tree. I recommend you ask for the table under the willow tree if you have enough time to make a reservation!

Follow MarleyRecs on Instagram for more!",24.0,Vivace
2021-08-24,2.0,"Used to love this place.  We took our son and fiancé for a special birthday dinner.  After appetizers and wine, almost an hour before our dinner order was taken.  I think we were forgotten.  No water, wine, empty glasses, no sever in sight.  When our dinner arrived, food was luke warm and the birthday boys' dinner was wrong.  Waited for his correct meal to arrive but all food cold by then.  Decided not to order birthday dessert.  Very very bad service overall , especially for the prices.  Food okay.... Probably better warm.  Won't be returning anytime soon.",9.0,Vivace
2021-09-06,4.0,"Ordered takeout from Vivace for my sister's birthday dinner for 7. We ordered the ravioli rosatio, the pizza bianca, the chicken parmesan, chicken marsala, gnocchi, small Caesar, and cheesy garlic bread. I didn't taste the food, but everyone in my party said it was delicious and there were plenty of leftovers for later. The food came in reusable black containers with clear lids and came with a half or full loaf of house-made Ciabatta bread. We placed the order for pick up and the instructions said to pull up outside and text them our car information and the order name. We followed the directions and ended up getting our order 15 minutes later inside. Please update the instructions on takeout so it's clear to customers to wait outside or come inside.",110.0,Vivace
2021-09-06,3.0,"This place is perfectly fine but I probably would not go back with so many choices in Charlottesville. Vivace was pretty crowded and you could kind of feel it from the waitstaff. So everything was a bit of a wait. As an indication, we were 50 minutes from arrival before Caesar and wedge salad hit the table. Salads were fine, nothing special. We had a Marsala and a ragu Bolognese. Both were fine. All in was a little over $100 plus tip for 2 apps, 2 pastas, and a bottle of wine. Not so bad.",63.0,Vivace
2021-10-07,4.0,"Great patio, decent drink menu and American-Italian specialties. Service is usually pretty good too. A Cville tradition that is fun to visit.",9.0,Vivace
2021-10-23,4.0,"Delicious food, pretty patio and great service from Miranda (even though the place was busy) - and a special shoutout to Joe who took the time to mail my credit card back to me after I accidentally left it at the restaurant! (I live four hours away). Will definitely be back the next time I visit C'ville - thanks!",13.0,Vivace
