Date,Rating,Message,Author Reviews,Restaurant
2023-08-07,5.0,"Great atmosphere, great food good wine.  Sat in the front room and Justin the bartender served us.  His recommendations were. Spot on.  He was very attentive.  My wife had the short ribs and I had the mushroom truffle.  Both ver served quickly and tasted great.  
Definitely recommend.",21.0,The Local
2023-09-07,5.0,"We had a nice evening here and for an up scale restaurant the cost seemed very reasonable. We had 4 and had salmon, short ribs and chicken which were all rated as excellent. The prime fillet was good. For apps the salads, shrimp, and buffalo empanada were all excellent. I would return here again. The drinks were straight forward and fun cocktails were just what we ordered. Overall a very nice place. Head a little south of main Cville",10.0,The Local
2023-09-09,5.0,"The local is from far one of my favorite restaurants in town. The food is unimaginably tasteful and cured. I always said that in my life good food it would come from home and nowhere else, however, this restaurant might be the exception. I can be precipitating myself by saying this, however, I do believe that the service at this restaurant definitely offers a different point of you when it comes to hospitality. It's inevitable to notice the kindness, warmness, and appreciation culture that comes from the beginning to the end of your experience. I must say that I was not impressed completely with the ambience, but everything else inside of my experience make up for it. And in addition to my statement, The Local, so far, has the best quality and selection of wines that I have tried in the city of Charlottesville.",9.0,The Local
2023-09-16,5.0,"We came here with a large group, so had the scaled down menu, but we were very happy with the food we ordered.  We will definitely be coming back for the full menu.  My wife ordered the Local ""River Oaks Farms"" chicken and I ordered the meatloaf wrapped in bacon, with bbq sauce on it.  Mine was a home run and I wish I had their recipe.",206.0,The Local
2023-09-29,3.0,"How the mighty have fallen.  For about six years, I considered this my favorite Charlottesville restaurant, but my last two visits have not been good.  First of all, the place has become very noisy.  I don't know if was a redesign, a more boisterous bar business, or a change of clientele, but the ambience has been ruined.  Second, the food has become inconsistent, and service has slowed to the point that I've been served tepid food on several occasions.  I am no longer recommending this place, which makes me sad.",25.0,The Local
2023-10-16,5.0,"The local is my personal favorite restaurant in Charlottesville. Since moving here 3 years ago, my partner and I have spent 3 birthdays and 2 anniversary dinners with The Local family. We love the rustic feel of the building. The service is always wonderful. Servers, bartenders, and bus staff are incredibly friendly, always quick to lend a hand at the drop of a hat. The food is divine. The truffle pasta is a staple and always has my partner coming back for more. My favorite entree is the tenderloin which may just be the best steak in Charlottesville. When it's time for dessert, make sure you try the chocolate pecan pie. The Local is easily a top 5 restaurant in Charlottesville!",3.0,The Local
2023-10-17,3.0,"We had my son's rehearsal dinner there Friday night.  I was disappointed  on several levels. The tables looked nice with the flowers and white tablecloths.  The drinks were great.  However, for the later party they forgot to put the crackers out with the cheeses and forgot to put out the desserts I ordered.  I didn't notice until late in the evening when I pointed out that failure to them.
  I was disappointed we weren't told that there were two other parties going on both sides of our room so the noise level and heat was high.  Plus, I've never attended or had an event where the point person we had been working with wasn't even there.  The beef was excellent but the trout was unappealing to look at and tasteless.
  Frankly I believe they were over extended with 3 parties upstairs and regular in-door and patio dining downstairs.",4.0,The Local
2023-10-28,5.0,"Came here for dinner.  Had scallops appetizer and cauliflower Brussels sprout  appetizer.  Main meals were meatloaf, angus burger, short rib and pork chop and everything was outstandingly delicious.   Dessert was chocolate cake mixed berry cobbler and this place was beyond excellent.   Highly recommend!",24.0,The Local
2023-11-27,3.0,"Eh.  Certainly not the worst dinner I've had but when the Local stacks up against other New American fare in Charlottesville it doesn't quite hold up in comparison. 3/5

TLDR the food is fine but not the best I've had here. If you're looking for ~$20 per person entrees for a decent night out you'll find it, but better and similar fare can be found at other spots around town.

The service and the ambiance are both good, it's very cute inside and old wood and bricks. The building is historic and it's well curated with local art. Tables are far too close together we were basically sitting on top of the people behind us and that was uncomfortable. Dining room was way too cold in the winter -bring a jacket.

The start we had a cheese and fruit plate. The cheese was pretty boring IMO - Brie, smoked Gouda, and then two white cheeses probably a cheddar and Parmesan. Fruit was grapes and apples. Good, but again kind of just meh.

For entrees, we had two pasta dishes at our table and two meat entrees. I had the shrimp carbonara, my friend had the truffle mushroom linguine, my boyfriend had the meatloaf (recommended by our server) and my friends boyfriend had the steak. All of us felt very meh - there was no standout dish everything was kind of just meh.

My shrimp carbonara was okay, the pasta was the star. It was perfectly cooked and the pasta tasted handmade. The shrimp half was tail on half was tail off and it felt cooked unevenly - some pieces were cooked too long and super curled and rubbery, some pieces were juicier. The sauce was a letdown - for a carbonara, this was like eating cheese water. Thin and very little flavor. I did not finish it and didn't bother taking more home. Not the best pasta in Charlottesville. This was the second dish our server recommended.

My boyfriend had the first recommended dish by our server, the meatloaf. It was wrapped in bacon atop mashed potato's and green beans. He said the green beans were slightly undercooked without much flavor but the mashed potato's were good. Meatloaf was good but could've used more sauce.

My friends mushroom pasta smelled delicious - she had similar takeaways about her pasta that I did of mine. Good pasta, but lacking in some flavor and thin sauce. Good, but not great.

Her boyfriend ordered a medium steak and this was definitely a disappointment. Let's just be honest - this steak was rare. He said the sides were good but the steak being undercooked and under seasoned was a let down considering it was a pricier item.

Beer was good, selection is decent.

Dessert was good we had peanut butter brownie w ice cream and a pecan pie. Very average but still good.

Overall I didn't feel like anything really stood out to me except the prices - C&O, Orzo and the Ridley, even Mockingbird all kinda have similar fare to the Local with some minor variations but all do a better job than the local with everything except price. Everywhere else charges about $30+ per person so I was happy we paid a little less but would've been willing to pay more for better food.

Overall the local is good but not great - personally Charlottesville restaurant scene is so competitive I would probably look elsewhere in the future for New American fare.",249.0,The Local
2024-03-02,4.0,We had dinner there last night. We split the short ribs. It was memorable. We will be back!,101.0,The Local
2024-03-06,5.0,"Do yourself a favor - go to The Local for dinner asap. 

Our meals (short ribs, pork chop and shrimp appetizer) were cooked beautifully and served promptly. We made some special requests that were graciously accommodated. Our food was full of flavor and served piping hot.

I'd be remiss if I didn't mention our server Justin. He was charming, informative and attentive without hovering. He asked right away if either of us were avoiding any ingredients. We explained that my husband is allergic to shellfish. It was so nice having a server ask that question up front. His recommendations were spot-on.

The next time we visit Charlottesville, we'll definitely return to The Local.",21.0,The Local
2024-04-07,4.0,"We went to The Local on the recommendation of the proprietor of the B&B we were staying at.  It's located at corner where there are three other interesting looking eateries. 

The Local is small and has a cozy feel to it.  We had reservations and were seated right away.  We had a big lunch and were looking for something on the lighter/small side.  The menu gave us plenty of options.

We started with the Local Cheese Board.  It has Parmesan, Bleu, Brie, Swiss and Goat cheeses with apples and grapes.  Perfect with our wine.

With both did salads as entrees and I added the crab cake appetizer.  My wife wasn't crazy about here salad as the dressing had molasses in it.  I tried it and liked.  I enjoyed my house salad, they include pickled onions and cucumbers in it.  The crab cake was perfect.

I can't comment about their entrees, but the food we ate was very good.

On the downside, the service started off good, but got a little slower.  The place was busy but not packed.  Also, the chairs are very uncomfortable.  

I would go back because the food was good as was the atmosphere.",33.0,The Local
2024-05-11,5.0,Excellent service and excellent food.  Beef tenderloin was very tender.  Crispy Rockfish very crispy and accompanied by an excellent teriyaki sauce.,5.0,The Local
2024-05-12,4.0,"If you are looking for a place to cater a group of 50-60 people, I'd definitely recommend. They served enough food and it was decent! The side dishes (Brussels sprouts, mashed potatoes, green beans, salad dishes, rice pilaf were excellent) the bread was bad/hard as a rock. The main dish (chicken or short ribs) did the job. The proteins both were a tad dry but overall, solid/good taste, like I said for the price and the service, not too shabby! Would recommend visiting with this type of party size as the outside venue was nicely decorated, neat and had extra details (flowers, glasses, silverware), which added an extra touch of charm and bliss to our dining experience.",44.0,The Local
2024-05-23,4.0,I went here during their set graduation menu. First i will say their service was very speedy. They were heavy staffed and very efficient in their dinner service. My only downsides are the gritz in the shrimp appetizer were grainy and the salmon could use more dressing and fresher veggies. Apart from that the meals were good and was a very fair price for the amount of food and quality of service. Additionally the place is massive and has many cool eating areas.,57.0,The Local
2024-06-23,2.0,"A good venue for large groups.  Not good for finer dining. Clue: if you have reservations available Saturday day for that night, probably not a good sign.  Food was very bland. I was able to finish only 1/2 my entree. Our server was nice enough, but too many mistakes. The upstairs was way loud!",117.0,The Local
2024-06-23,3.0,Waited too long at reception desk.  Cauliflower and brussel sprout starter was delicious.,26.0,The Local
2024-06-25,2.0,"The food was well below the quality as previous dinners we have had there, although we have experienced inconsistency.  The fish was greasy, flavorless, and overdone. 
The NY strip was mostly gristle therefore inedible.
Our server was also covering the bar solo including our table next to the bar 
therefore we chose not to complain. He was a super nice and did a great job considering his work load seemed unreasonable. 
It was extra disappointing as we were taking our daughter out for her birthday.

Probably will not return at this point.",17.0,The Local
2024-07-04,3.0,"So the food is good. But highly recommend you go in with a small group. Going in alone is a weird damned experience (at the bar). Bar staff does not want to small talk in down times. So, good food, not bad drinks, odd odd service. With a group I bet you wouldn't notice. I did once before, and that's the trick.",47.0,The Local
2024-07-07,5.0,Incredible restaurant in the center of Belmont neighborhood. You can eat inside or on the sidewalk. Food's great; service is incredible. Many great menu options.,207.0,The Local
2024-08-04,3.0,"One experience at the Local, and it looks like this:

Early reservations got us a table in a satellite space next to the main dining room, which looks like their wine cellar. Bare brick and wine bins were the vibe, with a server station tucked away in a corner. Tables were a little tight, which makes the place cacophonous when there's a large well-served six-top seated in the corner (ask me how we found out).

The menu was comfort-heavy from an entree standpoint (everyone ordered either steak frites or the braised short ribs, although there were three different gnocchi offerings). The apps were equally easy to choose from: we grabbed a cheese plate and the burrata caprese salad. The cheeses were fine, four large cubes of various white cheeses and a little round ball of chèvre. Plenty of grapes, cut apples, and box crackers made this a decent little appetizer value for four. The caprese offering was a great way to bring forth the current burrata trend by plating it on top of large sliced tomatoes over arugula, with a lace of a balsamic reduction all over the top.

The steak frites was passable, fries served on the side in a little bistro basket. The steak was played on top of a horseradish-artichoke bechamel  (I was so stoked for this, but alas, literally, weak sauce: thin, no sense of horseradish bite at all). To be fair: not sure if this is a case of incorrect expectation versus execution. It wasn't bad, just not sure what I got. The short rib was a nice long-braised short rib over a decent mashed potatoes: easy, accessible.

The wine list at the Local is simply lovely. We were seated right beside all of the several vintages of Stag's Leap: they are not playing around when it comes to wine. The by-the-glass list is simple, accessible, and affordable. 

All in all, the Local fit the bill for a family dinner out. It's comfortable food and wine that hits the table really quickly (we were in and out in less than an hour), and has something for everyone.",115.0,The Local
2024-08-13,5.0,"Went on a Monday night - they have half price wines by the bottle anything under $75.  The server told us over but they gladly honored the price of our wine.  The food was good - pictured is what I had.  The salad was good (maybe a few too many fried wontons) but nice flavor and not overdressed.  The rockfish was delicious but strangely served in a bowl which made it virtuously impossible to eat - cutting it became impossible and I had to ask for a plate.  They brought me a tiny side plate which didn't improve matters much.  Everyone else enjoyed their entrees  - crab soup, buratta special, steak frites, meatloaf, and fried gnocchi with scallops.  I'd definitely go again and would recommending this local spot.",60.0,The Local
2024-08-19,5.0,"Dined here twice with a large group while in town for a long trip and am very pleased with The Local. Service was really great - we had both Prince and Michael, and they were personable and hospitable. Prince was wonderful at getting to know us and make recommendations from the menu. The food was also really good - we had the cheese plate and Brussels/cauliflower to start which were big sizes to share. For meals we all had a variety of things, but I had the short ribs the first night and the salmon the second night - each tasty, and a nice portion size. For dessert I had a peach cobbler which was okay, but the chocolate cake was fantastic! This really is a great spot for a good meal, with great service, and cozy atmosphere.",61.0,The Local
2024-09-29,5.0,"Even with a small menu, my girl and I think that this place could satisfy multiple generations of picky family members. Absolutely wonderful food during my visit.",39.0,The Local
2024-10-06,5.0,"Food was delicious. Drinks were well made and not too $$. This is a cool little spot in downtown C'ville that supports local farms, brewers, and vintners. I highly recommend it!",46.0,The Local
2024-10-15,2.0,There aren't many vegie selections. The pasta dish wasn't great. Not a good choice for a vegan or vegetarian.,1.0,The Local
2024-12-07,5.0,"Nice staff and very accomodating (we were late for our reservation). Our waitress was very knowledge about the menu and made great recommendations. The crab soup (cream of crab) was amazing. Almost had like a buttery taste to it. Perfect flavor and for $8 for a bowl, can't beat it! I enjoyed the steak fries but wish it was cut some more. It was flavorful and cooked perfectly. I didn't try the salmon but my friend cleared their plate so I think it was a hit! Delicious drinks too and the ambiance chill, small, and very much like a local spot.",104.0,The Local
2024-12-09,5.0,"Absolute home run. We wanted to do something great on our last night in town, and The Local was suggested several times. It wasn't far, so we made the choice. Boy, did it work out well! Parking was tough, but after a few times around the neighborhood we found something. It's a happening area with lots of restaurants, so not a surprise. While walking over, we could smell some awesomeness. It's a very hip and historic place inside, and they make great use of the space in an old storefront. They were really busy, but we didn't have to wait even though we didn't have a reservation. Our server was awesome and gave us some time to choose between some difficult choices. I knew right away I wanted the she-crab bisque, and it was delicious. For my entree, there were a number of things that looked amazing, but I decided on the braised short ribs. They came on some tasty mashed potatoes, along with pearl onions and a mini carrot. The meat was perfectly cooked in red wine, and amazingly tender. The portion size was very generous and I couldn't even finish. I will definitely stop back in when I'm back I'm Charlottesville!",407.0,The Local
2025-01-02,5.0,"We came here for dinner on the Monday night just before NYE. The food was fantastic. The bison boa was awesome with lots of wasabi spice. Crunchy shrimp delicious. The short ribs did not disappoint. Then a host of musicians streamed in and a singer-songwriter open-mic followed. The music was great. The vibe fantastic. We loved our server. This place is a must, especially if they have music that night.",81.0,The Local
2025-01-08,4.0,"This was the most quintessential Charlottesville inspired upscale restaurant I have been too. Very fitting to be called the local. 

The food was solid, the drinks were great, and the service was good. The only reason I give this place a 4 stars rather than 5 is the price point. While not drastically overpriced the food I expected to blow me away. Maybe my expectations were too high and maybe I should give this another shot as many have told me great things about this place. I just walked away a little underwhelmed. 

Would try again.",140.0,The Local
2025-02-02,5.0,Went for restaurant week. Food was amazing. The cauliflower and Brussels sprouts were so good.,12.0,The Local
2018-03-12,5.0,"I'm only in Charlottesville once or twice a year visiting with friends but the local is usually a go to for our group! Recently they allowed us a private dining area, it's literally a separate building that houses many of the local wines they serve, intimate but spacious enough for up to 40 people comfortably. 

They allowed my friends to select a set menu with a variety of options for only $50 per person, this did not include alcohol. For a four course meal the price and good was great. The mushroom risotto was amazing as was the lobster macaroni and cheese for starters! The salad was even great and I'm pretty indifferent to most Restaurants house salads. The steak was cooked perfectly and seasoned well, I'm a MD girl so the crab cakes were just ok to me. The desserts were yummy as well. Overall great service and great food.",140.0,Tavola
2018-07-31,5.0,"The Local is one of my favorite places to eat in Charlottesville. Relative to other restaurants in Charlottesville, I think the Local has the best pricing for awesome food. - all in all, a PERFECT semi-formal DATE SPOT. Even affordable for a college student trying to do something a bit more fancy for a night.

FOOD: fresh and sourced locally! Hence this place's name. I think they've truly perfected the flavors here. Of what I've tried, the pork chops are great as are the roasted cauliflower and their steak. Their berry cobbler dessert is delicious as well. The fact that I've been here 3 times and have enjoyed my dishes every single time gives this place a 100% in my books.

SERVICE: So kind and so knowledgeable! I forget my servers name but everyone around us commented how awesome he was and their desire to tip him well. - white guy with brown curly hair!

AMBIANCE: Cute, cozy, and also great outdoor seating if you so wish. Their back area has a cool painting of birds as well.

Honestly 10/10, if you need a consistently great, semi fancy date night place TAKE HIM/HER HERE.",15.0,Tavola
2018-08-08,4.0,"I've had the opportunity to come to The Local both for work events and with friends and the food is always great every time I come by! It is definitely consistently high quality food that always leaves me feeling full and happy. I've had everything from the trout and burgers to steak and short ribs and food is always hot, fresh, and very well seasoned and flavored. 

One of the best things about this place is that there is so much ample space! It's absolutely great for large, large parties and there a ton of starter platters that can be made to share. 

It's a bit pricey to be eating here regularly, and the semi-formal vibe makes it difficult to justify as an easy option for dinner. The location away from UVA grounds also makes it a slight inconvenience to get to if you don't have a car, but it's a great place to bring guests as a solid introduction to the Charlottesville food scene!",94.0,Tavola
2018-09-17,5.0,"Went here for a rehearsal dinner and had the private room off to the side. It was filled with a warm ambience and so uniquely laid out - the wood and lighting complimented each other very well.

I had a house salad which was unique with pickles onions and an Asian flair, and the salmon, which was baller. The big cous cous was delicious and the green beans were flavored well too.

The presentation kind of looked like it was just thrown together on the plate, but keeping 5 stars for the great service and not having to wait very long at all for our large party (there were about 15 of us).",148.0,Tavola
2018-11-11,4.0,"I frequented The Local when I lived in Charlottesville and loved it, and I recently went back for a reunion weekend with some friends. We made a reservation about a week in advance since we had a party of 7.

The food and wine were delicious. Our table split a bottle of Pinot Noir. I ordered my usual, the Truffled Mushroom Ragout (Sharondale Farms shiitake, crimini, and oyster mushrooms, white truffle oil, and parmesan cheese, tossed with fresh house made fettuccine). It was yummy as usual! 

The only reason I'm deducting a star is because our waitress acted super weird when the majority of us ordered pasta instead of entrees. She goes ""you guys and your pasta! The entrees are much better."" I guess she was trying to guilt us into ordering more expensive items off the menu? Very odd.",401.0,Tavola
2019-01-07,4.0,"First time here along with a large group. They take reservations which was good for us as the place is popular and quickly filled up at dinner hour. Great selection of appetizers, wine, and entrees.

Food quality is excellent and the wait staff is very friendly and attentive. I went with the pork chop which was delicious and I would highly recommend.

I will be back in Charlottesville in the Spring (2019) and will definitely come back to this place for dinner.",351.0,Tavola
2019-01-31,5.0,"How anyone could give this place less than 5 stars sickens me. Nothing but praise for the Local, its ambiance and decor is this rustic feel that feels formal but also homely. The food here is art. The pasta is clearly freshly made and the meat quality here isn't gamey or dry. 

I've been here two times, the first being on a date. We both ordered pasta and it didn't disappoint. The second time being here was my birthday. The fries that came with my father's steak were delicious (I began to poach them after my meal was finished) and I personally got the glazed pork chops, which came out succulent and delicious. The cocktails here are unique and often times the Local tries to put their own twists on the mixed drinks that can be offered here. Nothing but praise for them.",253.0,Tavola
