Date,Rating,Message,Author Reviews,Restaurant
2023-10-30,4.0,"First visit to C&O. Lots of reviews and praise so thought I'd give it a shot. Restaurant is quaint which is a code word for small both in footprint and menu choices. And it can get noisy. Had a table on the upper level. Tables are spaced adequately but the open ceiling creates a sometimes noisy environment. Appetizer of Shishito Peppers which was good but could have been better without what I believe was garlic aioli. Companion had Salmon and rated it as outstanding. Nice, slightly crispy outside while translucent in the interior. Not over cooked. I had the Steak Chinois. Wasn't blown away. Cut of beef was good and although sliced at presentation, was a bit tough. Still it was cooked as I requested. I felt the sauce atop took away from the meat's taste and it somewhat ""buried"" the steak.  Desert of Sticky Toffee Pudding was served warm.  It was good but not something I'd order again.  The menu at C&O is, as noted, somewhat small but to be expected given the quality of the food and presentation.  Prices are no worse than any other fine dining restaurant.  Would I return?  Maybe for a special occasion.  But even though I might not return, C&O is still a restaurant I'd recommend.",152.0,C&O
2024-02-11,5.0,"OMG Everything was perfect!   Drinks, food, ambience.  Have not been there for 30 years when I last lived here.  Just moved back to town and was thrilled it was still open.  They did not disappoint.  So far my favorite restaurant in C'ville!",4.0,C&O
2024-02-17,3.0,"The ambiance was sublime, the wine perfect. The service was attentive and pleasant throughout. This restaurant is a local favorite and for good reason. Here's the thing: You need to like creamy dishes. Sorry, I mean you need to LOVE creamy dishes. The Steak Chinois is soaking in sauce. The duck breast special was delightful, but glazed to within an inch of its, er, life. We like to see the protein shine through on its own, but here every beef, duck, and (I'm assuming from the menu description) lamb is drenched in a tasty if over-applied sauce. This reminds me of Julia Child's American invasion. Of what we thought French food was 30 years ago. Even the Brussel Sprouts did laps through an aioli sauce. Everything seems to ride atop a bed of puree - be it potato or cauliflower or whatever. The meat was cooked perfectly, the dishes were tasty. But the overwhelming presence of a cream note to nearly everything on the menu (from reading, we only tried two)? 

Again, if you like saucy dishes, this is your Eden. 

We would love to come back when the sauce to protein/vegetable is more balanced. We are new to the area, and this approach seems to be working for this gem of a location - but goodness this was rich.

Oh, almost forgot. Order the fettuccini with mushrooms appetizer and just call that your entree. You won't be sorry.",8.0,C&O
2024-02-22,5.0,My wife ordered the scallop appetizer and. the salmon. I had to greens salad with a perfect dressing and the steak frites. It was all wonderfully prepared. The desert of a frozen custard was amazing.,9.0,C&O
2024-02-26,5.0,"This place was wonderful. First timer(s). We made reservations weeks ago. We visited this past Saturday @ 5pm right when they opened.  Service was impeccable. The appetizer (hand made fettuccine) was excellent. I got the Halibut special. My wife got the Salmon. Both were delicious. Prices are on the high side, but you have to consider where you are. We will definitely visit again.",347.0,C&O
2024-03-01,5.0,"A wonderful place for a special meal. Everything on the menu is delicious and you can't go wrong. The famed Steak Chinoise is excellent. The veal sweetbreads are so good, I think about the toasted bread all the time. It really leaves a food memory!! 
The ambiance is cozy & intimate. Such a unique little corner of the universe. I highly recommend this one-of-a-kind star of Charlottesville dining for many decades. A star among stars. Thanks for the memories, C&O - you were a favorite of my dear late husband, William.",34.0,C&O
2024-03-04,5.0,"Nice ambiance, relaxed atmosphere, decent menu, food is good, and prices are reasonable.  Great selection of beers!  Will definitely go back.",17.0,C&O
2024-03-08,4.0,"One of the best long term up scale restaurants in C'ville. 
 Can't wait till they bring back Duck al Orange. 
Love their sweet breads. 
Been eating here since 1978, 
amazing they have kept their high standards. 
Recommended.",55.0,C&O
2024-03-23,4.0,Vibes in the restaurant are pretty cool. It's located in a very old building with some history. The food was decent. We ordered a few things. Some dishes better than others. Our favorite was the scallops,12.0,C&O
2024-04-26,5.0,Place is pricey but the food is amazing.  The staff are also really nice.  Cocktails are also superbly prepared.  Go and have an amazing meal.,76.0,C&O
2024-05-03,4.0,"I found this interesting-looking restaurant online and booked it for my birthday dinner with my mom and her fiancee while we were in town.

We arrived at 8:30pm for their last seating (only reservation I could get) and were seated downstairs by the door next to a table of three men drinking wine and being loud.  The manager came over and asked if I'd like to move upstairs bc she knew I'd requested a quiet table.  That was great.  I appreciated that.

So we moved upstairs to a much quieter table by the window.

It went downhill after that.  Our server was french or something and he was rude.  It took a LONG time for him to come take our drink orders and when he asked if we wanted wine I said no and my mom ordered a tea.  He then asked if we were all OK with water and I said, let me see the drink menu, while I was looking, he simply walked away.  He didn't ask my husband or my mom's fiancee what they wanted.  We were like, what? 

My husband went to hunt him down and he came back and I said, just because we hadn't ordered wine didn't mean we didn't want something else to drink.  I ordered a tea and they ordered a beer and bourbon.  

After about 10 minutes I asked him where my tea was and he said ""Maybe I would get it"".  I was pissed, he was rude about it and you could tell he was trying to be a smart ass.  I realize bar drinks take a minute - but this was sweet tea and he was clearly catering to all his other tables and ignoring ours. 

I was pissed and planned to tell him off about how rude he had been from the start and exactly what we had done to offend him when I was trying to have a nice birthday dinner with my mom who I never see.  It's pricey to eat here - with entrees around $35-50 each and I don't want to be talked down to  or treated badly by servers when I've been nothing but polite.  I used to wait tables so I am a generous tipper and try to be mindful of asking for too much or try to give advance notice. 

The food was actually very good.  Everyone enjoyed it.  I had the potato encrusted salmon, my mom ordered the halibut, and my husband had their signature steak steak dish and I thought it was the best dish of the night.

They have a nice dessert menu and I saw several things I wanted to try but I went with the sticky toffee pudding in the end and it was very good.  They put a little candle on it for my birthday.

The saving grace was the same manager who helped me in the beginning, she brought us bread when I spoke to her and asked if they were out and had the kitchen heat up a little something else.  Our server didn't even try. 

My husband informed her of the issues we'd had and she was clearly appalled - she handled it very well and ended up comping the entire meal.  Rare.  Not what we expected at all...

It's nice inside with a cool vibe, the food was delicious and the manager was a 10. So, we'd come back again despite the rude server who almost ruined my bday dinner.",3183.0,C&O
2024-07-05,5.0,"C&O is always a big hit for a special occasion or to take out-of-town guests.
Service and food are so consistently on point. Thanks!",47.0,C&O
2024-08-03,5.0,The service was great and they took care of us on wife's birthday when a black cow in town took reservation while they were closed the staff at c&o was very accommodating and helped to save the day!! Thank you 08/03/2024,5.0,C&O
2024-09-21,2.0,"If you like overpriced, unimaginative, pretentious food served by a haughty waitress, then this is the place for you.",34.0,C&O
2024-10-05,5.0,"We are visiting Charlottesville for a wedding and stumbled upon this restaurant through open table. We could not have been more thrilled with this unique spot.

We started with the local little gem salad, perfect delicate flavors.  I had the butternut squash ravioli which was incredible. My husband had the veal sweetbreads.  I have not seen him that happy over a meal in quite sometime!

The ambiance is old mountain cabin meets speakeasy with a perfectly curated playlist set playing quietly in the background.

Wonderful experience from start to finish!",3.0,C&O
2024-11-08,5.0,"This was a great anniversary dinner! The ambiance was cozy and not too loud. We were greeted with a complimentary glass of champagne to celebrate. We started with the bread and butter. The bread dense, warm, with a slight sweetness. I tried the arugula salad with fig, candied pecans, and burrata. It was delicious and portioned well. For my entree, I got the duck confit and ricotta gnocchi. I was hesitant to get this since I don't typically order duck, but the waitress promised it was delicious. Sure enough, this was a memorable dish! The duck was so tender and roasted in a sauce that was flavorful and not overly salty. The ricotta gnocchi was a great accompaniment to the dish. My only wish is that there was more- I think there were only 4 or 5 total. My husband tried the crab cake and bolognese. I'm glad he got two dishes because one certainly wouldn't have filled him up. The crab cake was not skimpy on the crab and was paired with a nice sauce. The bolognese pasta was also pretty tasty. We ended the meal with creme brûlée. While it was pretty good, I've had better. We would definitely come back for another dinner.",139.0,C&O
2024-11-16,5.0,"I'm going to give you a 5, but I came for the Bibb lettuce salad (along with the tartar) and you took the salad off the menu yesterday.... Are you crazy?? Please put it back on the menu immediately!! xoMARK",225.0,C&O
2024-12-04,3.0,"KenScale: 7.75/10
Visit: October 2023

Shenandoah National Park in Virginia is one of the top spots in the United States to enjoy fall foliage, and my wife Jun and I had visited the park on a road trip every fall since we moved to the DC area. While we stayed at different places around the park, we had not visited Charlottesville where the University of Virginia is located until this year. When we finalized our plan to stay overnight in Charlottesville in late October last year after driving through the stunning Skyline Drive, I was looking for a restaurant to grab dinner. C&O, which had long been one of the most beloved institutions in the town, appeared in all of the several ""where to dine in Charlottesville"" lists I had found online. After our dinner at the restaurant, we both agreed that C&O is a solid choice for those visiting Charlottesville.  

The menu at C&O features classic dishes with French countryside influence. There won't likely to be a dish you hadn't seen before, but that doesn't mean the execution from the kitchen was overall good. We started with skillfully pan roasted scallops with whipped cauliflower, and shared a couple of main dishes in duck confit on top of ricotta gnocchi and grilled lamb chops. Jun, who has high standard when it comes to duck dishes, praised the duck confit as above average, and I thought the lamb chops (which came with mint salsa verde and potato puree) were grilled quite nicely. If you have room for dessert after savory dishes, I highly recommend trying a few at C&O. We both savored the vanilla crème brulee with enthusiasm, and the wild huckleberry sundae with caramelized pistachios was also wonderfully delightful.   

When we entered the restaurant, Jun and I were surprised to find white tablecloth on dining tables; we just hadn't expected a more formal dining experience, especially given the somewhat modest look of the exterior. If you are looking for a romantic dinner, I recommend asking the staff to be seated at the back of the dining room with candlelit tables. The wine list was another pleasant surprise at C&O where you will find an expansive group of bottles at varying prices from different parts of the world. If you are driving to the restaurant, you can park your car at a public parking garage nearby (the restaurant offers parking validation). While we have yet to fully understand or embrace what life in the Virginia countryside is like, I feel C&O quite adequately captures the culture and ethos of the region with soulful dishes that may not dazzle you like a Michelin star fine dining restaurant does but will nevertheless make you smile with satisfaction.",721.0,C&O
2010-02-02,3.0,"This used to be my ""spot"" while at UVA undergrad (til 2005). They're open late - the place is always jumping (*note: they don't accept reservations and at peak hours expect to wait up to an hour), and the food was amazing. It seems as though the quality has declined over the last few years. 

*The patatas bravas are still good, the tortilla española has been too oily, cheese plates have been significantly downsized (but still tasty), and the seafood from time to time is over-sauced. 

If you aren't a tapas fanatic, you may still enjoy the restaurant because, even with the few 'not so perfect', most of the dishes are prepared and served wonderfully. 

The prices are pretty steep, but it's Charlottesville - what else could you expect? If you want cheap tapas,  go to DC. If you want great tapas, go to Spain. In the mean time, shoot on over to Main St. and try Si Tapas...then make your comparison ;)",165.0,Mas Tapas
2011-01-21,3.0,"Good for a drink and a conversation. No mas.

Wait time was over an hour on a Tuesday night, while being only third on the wait list (for 2). The food was edible, but no dish was outstanding.

Many diners staked out their tables for what seemed all night in a pleasant social atmosphere. 

The no-reservations system evidently has its loop holes, as people continually passed us throughout the night for a large party.

Their spanish wine list looked worth exploring more. Sangria was good.

Bacon-wrapped dates - unimpressed.
scallops - just ok.
empanada and salad - fine.",126.0,Mas Tapas
2012-10-12,4.0,"Came here for my friends belated birthday Dinner. It's a actually a very chill and calm atmosphere nothing to loud or crazy. The seating is a bit limited but they also have patio seating But it was cold so we chose to sit inside. We ordered  a few tapas and 1 large pitcher of Sangria (they only have red) which has about 6-8 cups. It is a bit stronger then sangria that i've had but it's really good. The tapas  we tried were:

Datil con tocino -fat, juicy, pitted Medjool dates roasted inside of applewood-smoked bacon-really good mix of sweet and salty

Jamon y queso -18 mos. aged Jamon Serrano and Manchego Cheese- good but it needed a crunchy element

Empanada-roasted local , organic pumpkin from Radical Roots,chevre,sage in a flaky pastry w/ crema, honey- the chevre overpowered the pumpkin a bit

Judion-local,pastured  Mangalisa pork belly w/ buttery white beans from Leon,local organic chard,mirepox,tomatoes and herbes  -pork belly was melt in your mouth and the white beans were firm but had a soft center. I think I  could have eaten a whole bowl of them.

Pato confitado-raditional Catalan dish of buttery duck confit w/ fresh figs, concord grapes., garlic,Amontillo, sweet butter

-figs were so fresh tasting 

wAtun-#1 Grade Yellowfin tuna grilled very rare only served w/smoked tomato alioli,grey sea salt- smoked tomato alioli was amazingly good.Tuna was a bit too over done but I'm used to eating raw tuna.

Chorizo -eponymous pork,garlic and pimenton sausage lightly grilled w/hearth-baked bread-chorizo had a nice snap to it.

Tortilla Espanola
the classic  Spainish tapa of yukon gold potatoes,sweet onions,local farm eggs,extra virgin olive oil, gray sea salt.- Dish was good but the potatos and onions lacked a bit of flavor the gray sea salt on top helped but w/o the salt the dish was a bit plain.


Our fave tapas were the Dates wrapped in bacon, the wAtun  yellowfin tuna w/ the smoked tomato alioli and the Judion mangalisa pork belly with buttery white beans.

All the dishes were really good and you could taste the freshness in the local ingredients.  Although the tapas are a bit pricey you have to remember that  your paying for quality of the food and experience .I am  for sure coming back the next time I'm in Charlottesville to see what other dishes they offer.",482.0,Mas Tapas
2012-11-17,4.0,"First things first: I don't like tapas. Call me crazy but small portions (or the shudder-inducing ""nibbles"" or ""small plates""), jacked-up prices, and a whole dinner built around communal sharing with an overriding aftertaste of hunger are not my idea of a good time. I'm quite surprised that the whole restaurant scene built around tapas has lasted as long as it has, because my philosophy is, I've found this awesome dish. I've ordered it. And now that I know how good it is, the sight of your fork coming closer and closer to the food in front of me is enough to bring a rush of red to my head. 

Anyway, I'm giving Mas a pass on my general resentment of Tapas, because I had heard for quite some time about how good the food was and I can fully back that up. Mas also features tons of locally sourced ingredients, from AMFog mushrooms to beef from Free Union Grass Farm and Silky Cow, which is nice in that you can taste how fresh everything is but bad in that if you don't get here early enough, the kitchen runs out of the more popular dishes, like the bacon-wrapped dates. The menu also has quite the complicated symbol and key system, with things like FUN, WILD-CAUGHT, and BALANCED PAIRING. 

My table first ordered a small pitcher of sangria to share, and it was the perfect acidic balance of fruit and wine. I will say that I could have easily gone without my one glass of sangria if it meant that the $20 could have gone towards two extra dishes, but the birthday girl requested some booze. But you want to hear about the food! These were the dishes that came recommended by both Yelpers, friends, and waitress. 

Datil con Tocino: aforementioned bacon-wrapped dates. Comes 4 in one bowl. It's kind of impossible how something so simple can taste so delicious, but this was one of the dishes that I wish we could order extra of. 

Ensalada de espinaca: baby spinach with pine nuts, raisins, and mango vinaigrette. Palette-cleanser and provided some greens. 

Papas con crema: like a potato lasagna stuffed with Manchego cheese. Wait a bit for the cheese to crystallize on the bottom and you get nice crispy dark brown bits. 

Roasted artichoke hearts and goat cheese: wished for more hearth-baked bread. 

Chorizo: pork + garlic + pimenton sausage. I'd be okay with eating this, cheese, bread, and wine for the rest of my life. My stomach probably wouldn't. 

Empanada: pastry turnover stuffed with pumpkin, ginger, sage, with some cheese-like creme on the side. More savory than sweet. 

Fat Gulf shrimp grilled in their shells: my eyes popped out of my head as soon as I spotted a waiter carrying these babies to a nearby table. So succulent. It was like everything else in the world had disappeared and all that remained was the shrimp and I. 

Albondigas: beef and pork meatballs. Wanted more shrimp. 

We also ordered the hugely disappointing goat cheese cheesecake: the goat cheese managed to overpower any hints of sweetness or sugar. The little dollops of raspberry syrup on the side did not help. 

Tip: come as early as possible. My group of 7 came here at around 5:30 on a Friday and snagged the last big table in the back. Fifteen minutes in, a line had already started forming for tables, though there were still a few empty seats in front of the bar.

Would like to come back soon to have a Racion of that shrimp all for myself.",1423.0,Mas Tapas
2012-11-29,3.0,"The menu changes often so I suggest talking with your waiter and ask for descriptions and suggestions. I love the open kitchen and watching the chef prepare all the dishes. The food comes out quickly so props to the chefs but the service can be extremely slow because it can really crowded. From my experiences, your waiter can really great or really bad. They really need to make their service more consistent. 

Many of the items are just wonderful on the menu and I really like how they stay conscious on using seasonal and local items. My favorites include the yukon gold potatoes with aloi, bacon wrapped dates, artichoke goat cheese dip, shrimp with aoli and sea salt, beef tartar, and raw tuna salad. The plates can range from $4-$20 for the ""tapas"" or regular size and they offer the double sized portion for each dish. I suggest staying towards the lower end because I feel like the more expensive items are not worth it and are not as easy to share. 

Some items may also be a miss so be careful--again, I recommend talking to your waiter and telling them your preferences! For example, I tried their chirizo once and they were like a charred bricks. The Serrano ham dish with the manchego cheese is also not worth it because it's just really thin slices of cured meat with even thinner slices of cheese. Their hummus was also not very special. 

Tip: They do not take reservations so it's best to go during off times or weekdays. The wait can be 1-2 hours .

Tip: Instead of ordering the bread alone which is already $4, order the cheese dips because they include their house bread for just a few bucks more. 


Food: 4
Value: 3
Service: 2.5

Overall: 3",618.0,Mas Tapas
2013-03-15,4.0,"LOVE this place. Who knew that Charlottesville have a food cult?! What a great find. This was a perfect spot for dinner. It was a tricky finding the entrance on the patio but it was urban chic inside. The downstairs was super breezy near the door, so bring a coat! The setting was dark and modern. The bathrooms discretely overlooked the seating area, covered in wooden paneling. 
Food wise was a gastronome's delight! Of course the obligatory spanish olives, plethora of distinct cheeses and a larger selection of either wine or beer. Though I didn't find the papas bravas (roasted potatoes  w/alioli) that impressive, the jamon, empanadas and ensaladas were que delicioso! 
Save room for dessert, which was just as enticing. A smooth scoop of chocolate mousse artfully presented with sweet market fresh strawberries and a dollop of cream fraiche and coarse sea salt was perfection.",2071.0,Mas Tapas
2013-09-12,5.0,"This tapas place is definitely worth every star. Friendly waitress, intimate/classy yet fun setting (including a huge patio), fantastic food, killer sangrias, awesome company ... what else could you really want in a night? (Although I can't guarantee you the great company when you visit. Thankfully I came with great friends).

The restaurant uses ingredients from about a dozen or more local companies, which is an added bonus. Lots of organic and fresh vegetables and free-range chicken. Just looking at the menu and the vast array of choices can be overwhelming, but I feel like a lot of thought has put into not only the types of ingredients used but the way they're cooked/paired together to prepare each dish.

We ordered plenty of food for the three of us to share and feast on, but the one I keep remembering is the bacon-wrapped dates. I didn't even know I liked dates! Fat, juicy and pitted, roasted inside of applewood-smoked bacon. 

Another great dish: the smoked tomatoes that were resting in their own tomatoey juices.

Also had dessert: the dark, bittersweet flourless chocolate cake with berry coulis. It tastes exactly as it sounds!",499.0,Mas Tapas
2013-10-14,1.0,"We were excited to come to Mas for a great family dinner based on recommendations from friends and Yelp. Overall the tapas were pretty good with one big exception.  We ordered two orders of Carne Asada for our table and were a little surprised at how rare it was served. Believe me, I like my steak rare for the most part, but this was really, really rare.  Actually, it looked dangerously rare in my opinion. 

When our waitress came by we asked if we could please get the meat cooked a little more as we were concerned about how raw it looked. Much to our surprise we were told the chef will not cook it anymore because it is suppose to be served very rare.  Hunh?  Is the chef eating with us?!?  Is the chef paying for it?!?  I've never heard this before. 

Anyway, the servers were pleasant but the chef sounds like a real ass. His food certainly isn't nearly as good as he thinks it is!  Good riddance and good luck!",9.0,Mas Tapas
