Author,Date,Cool,Funny,Useful,Rating,Message,Author Reviews,Author Friends
Sean S.,20/09/20,,,,2,"Food all tasted the same. Pork tacos, dumpling, etc. Very blah. Service left much to be desired. Many other restaurants doing a better job out there. Don't waste your time. 

We all got eaten alive by mosquitos while trying to eat dinner. You'd think they would spray something out there to help with that. Hard pass this spot until things get back to normal.",8,3
Caitlin C.,30/09/20,,,2,5,"COVID: you're given a clean basket with napkins, forks, and knives and are assigned a table. Tables are ACTUALLY 6 feet apart and the tented area was nice. Usually when I sit outside there's a lot of bugs but I didn't have this issue. Food is given in little boats with small paper plates so no dishes are used. 
FOOD: For a long time I've heard about bang and have wanted to go and I'm SO glad I finally did. The food was all incredible and flavorful. My favorite was the coconut rice...I'm not a huge coconut fan but it was subtle and so delicious. I can't recommend just one thing because I truly loved everything I ordered but I was most impressed with the coconut rice. 
The only annoying thing was that I had to pay for a water bottle but I understand it's part of their COVID policy. I'll definitely be coming back soon!",157,26
Emma S.,04/10/20,,,1,5,"Easy takeout spot, with delicious Asian-inspired tapas! You must try the firecracker shrimp if you go here!",23,273
Ben W.,11/10/20,,2,,1,"This used to be a favorite of ours. They have completely fallen apart. They have not handled COVID well at all. Drinks come in little plastic bottles to be drank out of plastic cups. The menu / ordering system is so confusing that the wait staff has no idea what you have ordered. They drop it off in fast food paper plates and call out what it is over their shoulder as they walk away. The service is terrible now. 

Bang is definitely a No Go these days. Save your money and go somewhere that knows what they are doing.",18,
Matthew H.,14/10/20,,,,4,"FOOD: 
- pretty good asian inspired tapas
- recommend: pork belly bun, beef dumplings
- I would get pickles next time too to cut through the fried food-feeling
- ALL the sauces are the same... Why??? Kinda lame

DRINKS:
- sin city cocktail is delicious! Sweet with a bit of the alc still coming through.

PRICE:
- IMO overpriced $$$ (like all tapas tbh)
- buns are $4 and puny, only go for the pork belly one tbh cause that one is justifiable

This seems like more of a ~experience~ place you go with a lot of people. Food is nothing special but still good.

Edit: went to cookout after. Lol",65,2
Alison W.,11/01/21,4,,2,4,"In-person dining at Bang at this time is very conscious of social distancing and covid restrictions which I very much appreciate, although it results in lackluster service and takes away from the presentation and atmosphere. Given the current circumstances though I can't hold that against them. We tried a whole variety of menu items, as follows:

Would order again: genera tso's cauliflower, fried brussels, Kale Caesar

Enjoyed but didn't love: goat cheese dumplings, fried chicken buns, pork belly buns, edamame

Would pass: drunken noodles

The vegetarian items were the star of the show. As with most other tapas, I found Bang to be slightly overpriced for what you get. And due to covid we had to pay for water bottles which seemed a little stingy. I'd love to come back and try more menu items and cocktails once indoor dining gets back to normal.",174,251
Destiny L.,13/04/21,,,2,5,"This is an awesome spot within walking distance to my apartment! Beautiful downtown location in what seems to be a remodeled historical home! Very quaint! 

Upon entering the area we were greeted with a sign at the front which explained dining instructions, takeout instructions, as well as opening hours! (Pictured)

We of course opted to sit outside on their front porch to look at all the beautiful plants and spring scenery! We were seated, and greeted by a sweet server who told us about the menu and how to work it!

I came into this knowing we would order several small plates to share so here we go!

Caesar Kale Salad- this was very crunchy, fresh, and cool on a warmer day! It was beautifully plated and seasoned nicely. It was a little on the sweeter side for my liking but I enjoyed it anyways! (Love a good starter salad)

Drunken Noodles- These also had a wonderful flavor and were mixed with yummy veggies and mushrooms and a hint of spice amidst the sweet sauce!

House Pickles- I love pickles! Almost everywhere I go if it's on the menu, I'll try them! These are the sweeter type, not dill, tad bit of a spice, and very crunchy and delicious!

Chicken Buns- These are the BEST!!! The buns were so soft and doughy and the chicken was deliciously moist with a wonderful spicy Mayo! I could have eaten about three of those in addition to the other things we ordered! What can I say? I love chicken and this his all the spots for me!!!

Braised Short-Rib Dumplings- These were to die for and they certainly didn't hold back on the meat for all you meat lovers! They were literally packed with the tenderest rib meat with just the right spices! The miso mayo was a favorite and complimented the dish very well!

Crab Pot Stickers- Came out beautiful as did the rest! The post sticker had a nice crispy shell that wasn't greasy at all. The filling was a nice blended filling with a delicates crab and seafood taste (according to my husband, I'm not the seafood lover). They looked awesome and as was everything, BEAUTIFUL!

Water was brought out complimentary and we ordered two sprites which were served in cans with glasses of ice. I noticed they had many drinks, sake, beer, so I wanted to try out something non-alcoholic (daiquiri, special soda, mock tail) because I no longer drink, but unfortunately the basic sodas and water were my options. This will not hold me back from visiting in the future! We would like to return for dessert, and some other offerings!",79,205
Gabrielle H.,15/04/21,1,,,4,"Enjoyed the meal sitting out on the back patio. Friendly service. Our favorite was the goat cheese empanadas and brussels. Wish the broccolini didn't have so much sauce on it. Otherwise, fantastic meal! Would come back again.",42,6
Rachel M.,27/04/21,1,,,5,Went back to bang and the food is still immaculate . Really can't complain about anything. Get the cauliflower!!!,80,9
Priscilla O.,21/05/21,,,,2,"The hybrid QR code paired with live waitress concept didn't work very well. Our waitress was pleasant but we hardly interacted with her after she explained that we could either fill out an order form on the table or order online via the QR code. She mentioned there were a lot of daily specials online but couldn't remember what they were because there were so many. We got the impression that the restaurant preferred us to order online rather than engaging the waitress. 20 minutes later the waitress dropped by to ask if we were ready to order something. Which we had already, 20 minutes ago via the QR code. The picnic table in the backyard that was assigned to us butted up against the plantings and we ended up trampling half of them getting into our seats. This also stirred up the mosquitoes, which bit us savagely. As is the case with fusion food, all three dishes we ordered were uniformly sweet.",251,155
Lily H.,23/05/21,,,,2,"Food was served before drinks 
Food delivered to the wrong table 
Waitress handed glasses to customers instead of setting down on a table. 
Wasn't told until time of payment that cash wasn't accepted. If I had known I would've dined elsewhere. 
Food was average but the edename was rock hard",19,6
Erin R.,30/05/21,,,,4,"I'm a big fan of Bang! We came for dinner on a Friday night and were able to snag a table outside.  We ordered a lot.

*Pork BBQ Taco: A fun crispy shell and a generous heaping of savory shredded pork. I am not usually a bbq taco fan, but I liked this one because it wasn't an overpowering bbq flavor

*Short Rib Dumplings: These were excellent!! Savory, good amount of meat, dumpling wasn't overly thick

*Korean Beef Empanada: Pretty good. the Meat wasn't evenly distributed but still flavorful

*General Tsos Cauliflower: I don't know why but I wasn't expecting breaded and fried, but it was and the flavor profile was spot on

*Crab pot stickers: Probably my least favorite. The crab flavor is just over powering so it was a little one note

*Goat cheese dumplings: YUM. lightly fried goat cheese works.

*Tuna poke bowl: Really good. Would be better if the tuna was raw, it didn't need to be seared

Our server was super nice and the food came out quickly.",1001,313
Haiku 4 U.,31/05/21,,2,,5,"Today I met an angel. His name is Luke and he told me to sit at the table to the left and then he told me what to order. Honestly, I'm pretty sure if Luke told me to jump off a bridge I'd step right up because I'd trust that he's directing me to epiphany.

Real talk. You need to come here. Order anything on the menu because it's all so delicious it will make you feel disgusting later and I mean that in the best way.

So ultimately...

Come and taste heaven
General tso's cauliflower
Goat cheese dumplings too",41,2
Justin N.,23/06/21,,,,4,"Came here on a date. It was a nice sunny day and we were seated in the back patio. The restaurant is cute and the outdoor seating is nice. We ordered the Brussels, Ginger Pear & Avocado Salad, Pork Belly Steamed Buns, and Sweet & Sour Pork Ribs. The Brussels were delicious but I felt like the other dishes were average.

The Flash Fried Brussels tasted amazing. They were perfectly fried, and the sauce and seasoning on the Brussel sprouts were tasty. I would definitely order this dish again.

The Ginger Pear & Avocado Salad had a great flavor profile. The sweet pear, salad greens, and dressing were really nice; however, the dish would have been perfect if the avocado were fresher (dark spots can be seen in the picture). For a restaurant like Bang!, I would expect the ingredients to be fresher and held to a higher standard. Especially the vegetables considering it leans more vegetarian in its options.

The Pork Belly Steamed Buns were good but not amazing. We enjoyed the dish; however, coming from DC, I've tasted better and more delectable pork belly buns.

The Sweet & Sour Pork Ribs were average. There are definitely better ribs in Charlottesville for much less. That's not to say that the ribs tasted bad because they tasted good, but for the price they did not meet my expectations.

Overall, Bang! is a a good spot for date night. The restaurant and outdoor seating is cute and perfect for a nice summer day. I would highly recommend the Flash Fried Brussels if you find yourself here.",372,109
Ariel G.,10/07/21,,,,4,"I had come here once before and came back with my boyfriend because of my raving review the first time. Unfortunately, the food didn't measure up this time around, although the goat cheese dumplings were truly a delight (and likely the most popular item). 

Before ordering, we were told that the tapas (as the name suggests) are fairly small, except for the drunken noodles and the tuna poke bowl, so we should order 2-3 per person. We opted to order 6 in total (ended up being 5 because one of the items ordered was forgotten by the restaurant, and we chose to cancel it). Wow was that a mistake. The portions for many of the ones we ordered were huge! All except maybe the goat cheese dumplings, which we absolutely liked the most.

We ordered:
1. Sweet potato gnocchi
2. Goat cheese dumplings
3. Fried brussel sprouts
4. Kale caesar
5. Tuna poke bowl
(We cancelled the thai carrot and mango salad.) 

The best: goat cheese dumplings, followed by the sweet potato gnocchi. So rich and yummy.

If you're a drinker, the whiskey sour is a MUST to order. It may be the best whiskey sour I ever had. My boyfriend got it, and I immediately regretted my rosé wine choice. They can definitely be dangerous if you get more than 1!

The rest: nothing to write home about. The brussel sprouts were drenched in the cream. I tried to pour some of it out onto another plate, and it was just leaking sauce. My boyfriend liked the kale caesar, but it was nothing special to me. The tuna poke bowl? Seared tuna--not what you'd expect for poke IMO. 

We weren't in any rush, but be prepared to wait a little bit for your food, as they appeared to be understaffed but very busy. We thought we would have to wait for a table outside at first, given a sign indicating a 30-min wait when we arrived. However, there was plenty of outdoor seating in the back. We sat at a huge picnic table--just the two of us. The downside? The picnic table was crawling with little ants, so we had to use a spare paper menu to get rid of them throughout the meal. Nothing says romantic like insects.",142,23
Emily C.,20/07/21,,,1,3,Came here on high recs but food and service fell short. Service was attentive at first and then like a ghost. Took me at least 15 min to order a second drink. Food is underwhelming and mostly fried.,31,2
Aubrey W.,21/07/21,1,,,5,"I've been to Bang! a few times, and each time I enjoy the food even more (if that's possible). We ordered 6 dishes: goat cheese dumplings, sweet potato gnocchi, red pepper and feta rangoon, duck and chicken steamed buns, chicken empanadas, and miso donuts with sorbet. The duck steamed buns and sweet potato gnocchi were my personal favorites. The sauce on the gnocchi has the perfect balance of savory and sweet, and the gnocchi itself was super tender and flavorful. The duck paired amazingly with the pickled red onions, resulting in a perfect bite! My dates favorite dish was the goat cheese dumplings, which were also heavenly. However all of the dishes we ordered were delicious. There were two of us, and although I was stuffed we managed to finish all 6! The only downside was that the service was very slow: we had to wait over 15 minutes for our bill. However, all the food arrived relatively quickly and the meal was phenomenal!",168,27
Elisa F.,24/07/21,,,,4,"Great apps and very fast and wonderful service. Prices were a little extra and the drinks weren't the best tasting but honestly food is worth it. Especially the desserts, do not skip!",9,1
Margaret G.,26/07/21,1,1,1,3,I was really looking forward to this place.  A little disappointed.  The food was average at best.  The best tapas was the empanada and the donuts...,86,56
Carla M.,10/08/21,,,,5,"Love it here! This is a new get together with friends and can share small plates. Their drinks are spot on and so is their desserts! Usually very busy on weekends so not sure if they take reservations, and if so make one! I hope to be back soon",41,3
Lindsey S.,29/08/21,,,,2,"Dude, seriously. I want to love this place but it was terrible. Everything is cobbled together of canned chicken, pre-made items, and lots and lots of oil. The noodles were stiff and undercooked in the drunken noodles, the empanada dough was also raw. The bao buns appeared to be made of canned biscuit dough. I'm not saying they were, but the quality was very low. It took a span of over an hour to receive our plates and everything was underwhelming except for the cocktail. Disappointed because I usually love Charlottesville eateries.",116,6
Michael C.,31/10/21,,,1,2,"We went here on a Saturday hoping for a good meal. It had been years since our last visit that was amazing. This was not the sam. We were seat promptly with out reservations, but for here were many seat open. Our server was just ""there"". no personality. Never smiled. Barely said a word To us between drinks and food. Drinks were extremely strong and well worth the cost, despite the small size. $10-12

We ordered rice balls. Very very soggy/greasy/oily. Fell apart when we touched them so had difficulty despite being efficient with chop sticks. The rice had very little seasoning and the sauce had less taste than lite mayo.. $9-11?

Drunken noodles...come on.
It was oily and very spicy. We only tasted heat and oil. No idea what plus were used. $12-14 not sure.
You want good drunken noodle.... Try Lime Leaf!

The deep fried shrimp. So damn small and greasy again. We tasted the same flavors/oil in each meal. It was mainly breading and teeny tiny shrimp. The bed of vegetables with it were great!   $16.00 or
So.",30,2
Emily K.,13/11/21,1,,1,4,"An incredible place for good food and good cocktails. No reservations so when we came in through the entrance at South street west and 2nd streets SW we stood and waited there in the cramped front entryway and no one assisted us for at least 5 minutes. It wasn't until we asked one of the servers if we could be seated that they sat us at one of the empty tables. The drinks were delicious, 100% recommend General Tso's Cauliflower it is crispy and sweet and the cauliflower is soft on the inside. Both drinks were phenomenal (and stronggg might I add)! Overall a great experience, I'd go back again, hopefully there'll be a new system for walk ins though!",214,212
Elisabeth S.,18/11/21,1,,,5,"Very nice people and great date night place. You must get the slightly sweet, definitely crunchy General Tso cauliflower. Loved the pork and baos as well. Go try it.",124,6
Phil D.,25/11/21,,,,2,"To the chef, go hide. The team supporting you is simply horrible.

Hostess-think her name was Jennifer, was rude and wasted our time. We arrived and placed our name on the list. 10 minutes later she said it would be 15 min. The we were waiting and she came and said it would be  be 30 minutes and to go across the street and have a drink, since the bar was full. She said go to the southern across the street for a drink, we did and after our drinks were served 5 minutes later - she texted and said our table was ready. Really? This is not brain surgery.

The service gets worse. The older mature man who attended to us ""the waiter"" never even gave us his name and treated us like we were in a car in line at McDonald's. His lack of support and attention to detail really made the 1st time experience at Bang - average.  He was not interested, didn't listen and had no enthusiasm for the waitlisted culinary experience. When we asked him what suggestions, he rattled off the three most expensive items. Really?

To the chef: of the 12 items we ordered the kale tortellini, pork taco, chicken bun were the best. Your food rocks. Maybe consider opening a food truck and be done with the noise of an average restaurant. You're better that this.

If the service was better we would have ordered drinks, wine, and more food.",345,1
Krista R.,01/12/21,1,,,5,This place is by far my favorite place in Cville. I love that it's tapas and you can get a little of everything. I love that the menu some what changes a few items here or there. The drinks here are amazing. The food is good portions to share. They hosted my bday get together with 10 of my friends and I. Everyone had a great time. The service was on point as always. The pack patio during summer is perfect with friends. Drinks are strong. This is my go to place when friends come into town. Hands down recommend 10/10,247,352
Lauren N.,02/01/22,,,,2,Lots of mayo and deep fried. Pork belly baos were not done right. I honestly didn't like anything except the drinks.,73,399
Shelly C.,11/01/22,2,,,5,Great service and yummy Asian fusion food. We'll be back. My drink order was too strong. I forget the name but it was a ginger vodka combo. I sent it back and they modified - still too strong for my taste. Kids enjoyed the food and there was something for everyone.,34,1
Joe D.,16/01/22,4,1,3,5,"Bang! Leaves me practically speechless every time I go. The food is consistently amazing even when toying with the different menu options. 

The way Bang! operates is not a usual dining experience you may be used to. When your dish or your neighbors dish is ready, it comes to the table. There is no waiting to eat until everyone has their plate. This also encourages folks to get beyond just one dish since they are indeed small plates. It is a fun style. 

To start the meal, I had the curried hummus with sourdough naan. Unfortunately, I did not capture a picture of this. That speaks to the quality of the dish. Every bite was scrumptious from the warm naan to the hummus with a kick. It is a great starter and shareable between two folks I would estimate. 

For my ""main course"" I ordered the Korean Beef Empanada and Chicken Bun. Both of these were excellent. My personal favorite is the empanada which I will order every time regardless of what else I get. The beef quite literally melts in your mouth. The chicken bun is also very good and should not be overlooked! For $4 it is perfectly fine to get a handful of these as your whole meal. 

My friend also let me sample his tempura sweet potato. From my small portion, I was a fan. It was fried well but not to the point where you lose out on the sweet potato. 

For dessert I got the coconut chocolate mousse. Oh boy I'm glad I did. While it was slightly difficult to break apart with the Graham cracker crust/base, each bite was divine. It was essentially coconut chocolate mousse on top of a baked Graham cracker crust. So good! 

My friends also let me try the miso doughtnuts. These were good but my clear front runner is the coconut mouse . 

Finally, in terms of drinks, I had the Sin City and Esoresso Martini. Both of these were good but I really enjoyed the espresso. It tasted like a sweet coffee drink from a coffee shop and really does well to mask the alcohol in it. 

Bang! Is a great spot for all - dates to family night out I recommend you stop by.",156,125
Lily H.,10/02/22,,,,5,"Best meal I've had in Charlottesville! I had 5 of the Wednesday night specials (perfect for 3 people) and each was incredible. 
Tempura Artichokes
Sweet potato gnocchi
Black pepper tofu and broccoli
Edamame dumplings
General Tso's Cauliflower

All so good!",11,
Stephanie G.,11/02/22,2,,,5,This will forever be one of my favorite places in Charlottesville. They were very packed tonight but the staff was incredible and constantly checked in to communicate the wait time. The new food on the menu was great and the bartender special drink is one to come back for.,1,
Cat R.,20/02/22,2,1,1,5,"Full disclosure - Bang! is my favorite restaurant in Charlottesville. Often tapas are an excuse for a restaurant to charge you more for less food but that's not the case at Bang! Their plates are medium sized and 2-3 dishes are plenty for one person. Cocktails are also delicious and, even though they're unstaffed, the servers are extremely attentive and friendly. We had Lauren as a server and she was WONDERFUL! Really enjoyed our experience. Come to Bang! and tip the wonderful staff well.",5,
Casey B.,24/02/22,1,,,5,"Love this place, but it is definitely pricey. Awesome for girls night, so you can share and try more things. Also good for a double date. I've tried so many things from here that I wouldn't normally eat and loved.",12,76
Danny J.,01/04/22,,2,3,1,Showed up on a Friday at 6pm. Restaurant was full with some large tables but got seated right away. We ordered 2 drinks and 4 plates. It took 45 minutes for both our drinks to show up. It's been an 1.5 hours and not even one plate showed up. We asked for our check for the drinks and left. The big table next to us ordered more food and got that right away. Do not recommend unless you are not hungry or have a lot of time on your hands.,98,50
Lindsey V.,16/04/22,1,,,4,"This is the place I take EVERYone who visits cville to. It's basically a bunch of small portions except for the ones that are $16, which come with a decent amount of food. The bang bang shrimp and the korean bbq both had a lot more food than I was expecting, which was nice for the price. Everything I've ordered here has been good, so I would just order whatever you think you'll like, because you probably will. The service can be a bit slow at times but the staff is very nice and welcoming. I will never stop coming here!",105,10
Melissa Z.,23/04/22,2,,6,4,"3.5 stars. Rounding up bc so few decent places in Charlottesville with vegetarian and vegan options.

The ambiance is so blah. Are there no interior design students to come in on the cheap and through some decor around? Because of the barren space, It isnt nice enough for a date spot.

Here are the plant based items I ordered, from best to worst:

Black Pepper Tofu. I was afraid to order this worrying f that there would be too push black pepper but it wasn't. The sauce was medium spice and the black pepper flavor was mild. You get a great amount of tofu and broccoli. This really could be an entree if you added a side of rice. This dish is why I boosted to 4 stars.

Drunken Noodles. delicious sauce and tender noodles made this one of the best drunken Noodles dish I've ordered. Other places sometimes use a boring brown sauce but Bang uses a slightly more complex sauce. 

Mushroom Bao Bun. I thought all bao buns were the same until i tried this one. This was much more dense than the airy buns I've eaten at other places. The mushrooms were shitake and had an excellent flavor that was let down by the uninspired slaw on top.

Flash Fried Brussels. Don't get the mayo bc this isnt lightly fried - its deep fried so very greasy and the mayo adds no flavor. If you ask for it vegan you'll get a different sauce.

I would come back bc of so few vegan friendly dining options in C'ville.",682,296
