,,Author,Date,Cool,Funny,Useful,Rating,Message,Author Reviews,Author Friends,(view source)
115,,Jeff W.,25/05/24,,,,5,"So creative, so delicious, so exceptionally done on every level. We sat at the bar and shared small plates. It was a challenge to limit ourselves to just a few - so many good options. Bartender made great recommendations and great drinks. We could go back every night. Highly recommend.",177,180,view review
116,,Elle P.,04/08/24,,,,4,"We really enjoyed our dinner here due to the eclectic and interesting dishes and pairings. A number of vegetarian dishes were creative and flavorful: charred broccoli, crispy potatoes and Korean pancakes. The grilled pork steak, steak and fried flounder (huge) were also flavorful and tasty. Fun and creative spot!",28,,view review
117,,Lil C.,01/09/24,,,,5,Everything was wonderful but the fried chicken and the salad were off the charts delicious. We will definitely be back! And they made a special ginger margarita with salt that was heavenly.,17,8,view review
118,,Aileen H.,12/10/24,,,,5,"We started with the shaved salad, which was excellent. Each dish that followed was equally as delicious if not better. The fried chicken was a standout as were the carrots; the speciality pizza with apples, bacon and honey was simply wonderful. Excellent cocktails. PARKING is frustrating. Plan ahead. I recommend just going straight to the train station lot. I'm from a large city that is known for bad traffic but I believe this small college town on a weekend night is worse! That said, we loved this restaurant and wish we lived closer to eat here more often.",4,23,view review
119,,Paul M.,13/10/24,,,,5,"Perhaps my favorite restaurant in Charlottesville.  The food is always fresh and delicious. The twists on the menu are always welcomed and creative. They also have pizzas, shareable appetizers, or full entrees depending on your mood, budget, or hunger level.  Full bar, great indoor/outdoor seating vibe.  Staff is awesome too.",76,,view review
120,,Whitney W.,17/12/24,,,,5,"The food is delicious here. Was not expecting such great flavors from a rather simple looking menu, but every dish was delightful and tasty. The service was fast, family style serving, where meals come out as they're ready which keeps you on your toes and looking forward to what's to come as more and more items come out. The restaurant itself is very cute and has a great ambiance. I'd recommend the trout, fried chicken, charred carrots, shaved salad, and pork steak! Overall everything was sooo good.",13,,view review
,,,,,,,,,,,
