,,Author,Date,Cool,Funny,Useful,Rating,Message,Author Reviews,Author Friends,(view source)
26,,Kimberly D.,30/04/19,1,,2,5,"Great service, ambiance, and food. Cocktails were tasty. We ordered the steak and a pizza for entrees - both were well flavored and prepared. The presentation of the steak was beautiful! We ended w the s'mores bread pudding which was good - a bit too sweet for our taste. I'll be back!",102,155,view review
27,,Crasha T.,04/05/19,,,,2,"Not a fan of the service. The server had a major attitude. She erroneously told us to order 2 entres, which is way too much food. 

What we ordered: pizza (it was actually good), carrots (surprisingly tasty and filling), hanger steak (horrible it tasted like liver), pork and pineapple (good), and the s'mores for dessert  (good). 

What really made them get the lower score was the steak was horrible, and the service was even worse. I have never felt so unwelcomed in a space that I was paying to be in.

Not a good experience at all.",42,1,view review
28,,Christopher F.,12/05/19,2,,3,5,"Came here on a recommendation from a friend.  This is a hip spot.  Nice looking bar but we chose a table.  Our server knew her stuff and made several great recommendations.  

First, the ambiance is pretty great.  I like the painted brick.  Decor is nicely done.  

The food is meant to be shared.

Started with the shaved salad.  This vegetarian option was fresh and light.  The dressing was a perfect match to the vegetables.

Next up were the charred carrots which were charred to perfection - is that possible?  

Moving on to the artic char.  The braised cabbage made for an interesting dish.  Really liked this one.

The sausage pizza was delicious.   The crust thin.  The peppers with just enough sweetness.  

For dessert, the pot du creme hit the spot.

Our whole party was pleased.   Great spot in C'Ville.",500,287,view review
29,,Cristina W.,16/05/19,1,1,1,5,"SWEET SWEET RICOTTA TOAST, YOU ARE THE STUFF DREAMS ARE MADE OF!!!! But seriously.  I had heard that Oakhart Social was amazing, but had no idea until recently how great it was when I came here for a large group dinner.  

The place is small plates-ish style - so you can def order to share.  If you only order one thing ORDER THE RICOTTA TOAST.  It is DELIGHTFUL!  The bread is that thick cut bougie fresh toast with that oh so creamy goodness of ricotta lathered on top.  It's then served with peas on top and a light and amazing vinaigrette. YES. It's a win. You won't regret it. I promise.

The other dish that stood out to me as well was the mushroom pizza.  Amazing cheesy goodness!   Plus, got to love the fungi!  The pork steak is also quite an impressive plate - so not for the faint of heart.  Ok, but not-so-faves, stood the scallion pancake and the wood-fired oysters... 
If you come by during happy hour, there are a few food specials and the fired mushrooms are also quite delicious.

The beverages are also good to the last drop - carefully crafted they are so well thought out and truly different.  I was a big fan of the perfect perfect manhattan as well as the mezcal pineapple beauty that was recipe number 22A version of the cocktail.

But for real, my key takeaways: fab place, primo cocktails, banging food, and get. the. ricotta. toast.",313,245,view review
30,,Nick D.,17/06/19,,,,4,"For how small this city is it surprised me that it was so hard to get table. We had called multiple times and finally ended up just sitting at the bar (with full service). It was odd to me though that when we walked in there were a TON of empty seats in the main dining room which apparently were being saved for others who had made reservations beforehand, funny enough even after our full meal, those tables were still empty, oh well.

The bartender was super friendly and gave us many recommendations for different things to eat and drink.  We tried the house sausage pizza which honestly was just so-so at best. We also tried the Ricotta Toast which also was apparently is what this place is known for. It was certainly an interesting take and definitely enjoyed it. This is a really cute restaurant located on the main strip of downtown Charlottesville would definitely return!",693,502,view review
31,,Ana D.,24/09/19,2,1,2,4,"Came here twice so far and both times were very pleasant. Sat outside to avoid the wait the first time and because it was such a nice day out the second time. Second time around there were three of us and we ordered the shaved salad, beer battered flounder, fried chicken, and the pork steak. 
I am not a salad person but I actually ended up being a big fan of the shaved salad. Enjoyed all the other dishes as well. The four were enough food for the three of us and we had some leftovers. 
Service was quick and friendly. Price was reasonable, about ~40 per person.
Would come back.",280,235,view review
32,,Brenda S.,23/10/19,,,,5,"We love this restaurant!!  We were here on two separate occasions prior to hosting an event in their private events room.  Each time we visited we were so impressed by a how fresh and creative the dishes were.  My personal favorites are the charred carrots and hangar steak.  The ribs are also top notch.  
This past weekend we hosted a rehearsal dinner in the events room.  We can't say enough about manager Ben Clore.  He was wonderful to work with.  He was so helpful and flexible with helping us plan this special evening.  We had approximately 40 guest in the room,  it could have held more comfortably.  The food was so amazing!!  Our friends were commenting on how delicious the food was and how intimate
the room felt.

 Huge thank you to Ben and staff for making it a perfect night!!",4,,view review
33,,Gloria R.,04/11/19,,1,3,5,"Still thinking about our seriously delicious meal here, one week later. Service was perfect -- friendly, knowledgeable, prompt. My friend and I shared the Shaved Salad, Oyster Mushroom, Grilled Pork Steak, and deconstructed S'mores dessert. The Shaved Salad was a hit and gave us the feeling that there was a great meal ahead. I loved the crispy parmesan crumbles and salad dressing, which was creamy but tasted light. The Oyster Mushroom was so delightful we practically licked the plate clean. The Grilled Pork Steak gifted an explosion of flavors thanks to the pineapple, jalepeno, and peanut topping. My friend and I were in disbelief as we happily savored each bite. 

We were too full to properly enjoy dessert, but the chocolate was just sweet enough and not at all overpowering. Overall, a terrific experience! Worth the substantial bill. 

Atmosphere-wise, the restaurant feels warm and full but not too noisy or overcrowded. If you choose to sit outdoors, they have heat lamps and wool blankets to keep you toasty.",75,12,view review
34,,Vita W.,05/11/19,,,,5,"-What you need to know in a sentence: One if cville's best that serves delicious d that have influences of all types of cuisines
-Ambiance in threeish words: way classed up garage- it use to be a fire station!
-Treated like: service is friendly, nice and kind.
-Must try: if you don't try the charred carrots you've done something wrong. The fried chicken is also excellent
-Other random tidbits: it gets packed on a weekend migh",65,15,view review
35,,Lyndsay W.,18/11/19,,,,5,"Pricey but worth it. Great for a group if everyone is down to share. I really liked the oysters, the charred carrots, and the fried chicken. The service was awesome. Definitely need to make a reservation in advance.",195,135,view review
36,,Elizabeth H.,22/11/19,,,1,5,"It's about balance right?

You run 5k to not feel bad about the dessert you ate. You order vegetables so that the pizza doesn't seem as bad shared. When I travel for work, I always look for a new spot to try and get inspired. I'm Charlottesville, I was taken to Oakhart Social @oakhartsocial; it felt like I was walking right into a local Brooklyn spot. To paint the picture the walls were full of brick, painted white, and the floors of reclaimed wood. A bit dim in the space, there was a coziness in the air.

Our Picks:
Charred Carrots
Shaved Salad
Pepperoni Pizza
Pork Steak
Squash

There is no doubt in my mind that I would come back. The food was delish (small plates meant to be shared), service great and a great fusion of flavors.

#charlottesville #virginia #diningout #worktravel #travel #wanderlust",86,96,view review
37,,Ruchi S.,19/01/20,,,,5,"Everything we  ordered was delicious. The service was impeccable. Would totally eat here again. 
P.S: The staff is very kid friendly!",13,,view review
38,,Katherine L.,13/03/20,,,1,5,"We found this place on Yelp when traveling in the area and it did not disappoint. The service was excellent. Our waiter was great, and the food came out quickly. Each item that we ordered was delicious. We left feeling satisfied, but not stuffed. The food was all packed with unique flavor combinations, and the chicken was extremely tender. The atmosphere was also very comfortable.  Would recommend this restaurant!",94,153,view review
39,,Janette B.,12/09/20,,1,,5,"'Been there several times __ from Seattle, WA. The food is a revelation: Chef Tristan Wraight is a master of visuals, textures & taste-combinations. Inventive dishes that satisfy more than just the appetite, but also pamper the desire to indulge one's senses. I'll go again. And again.",19,,view review
40,,H G.,15/10/20,,,,5,"We were very pleased with this restaurant. The shaved salad had so many flavors and textures. My partner doesn't like salad but ate most of the shaved salad. The sweet potato dish was really unique and our favorite small plate. The ranch on the carrots was the best ranch I've ever had. 

And the  margherita PIZZA. So good. The crust itself has so much flavor. They are really tasting everything to make sure their salt level is perfect. The pizza had a nice char in certain spots. Also I could taste the sauce pizza and it seemed like a really elevated tomato sauce. It was a perfect thin-crust pizza. 

The gin gemlet was our favorite cocktail. It was slightly sweet, with citrus, basil, and gin flavors.",141,,view review
41,,Owen B.,31/10/20,4,,4,5,"Their burger is my favorite in town.  Easily.  Better than citizen slimers, better than jack brown whoppers, and yes even better than riverside. The cheese, the pickles, the MarieBette everything brioche.  It's perfect.",379,215,view review
42,,Courtney K.,14/11/20,1,,3,4,"Bottom Line:  Good food and prompt, friendly service.

My husband and I enjoyed a Sunday dinner at Oakhart Social.  We really enjoyed the uniqueness of the shaved salad.  I'm sure a lot of work goes into that salad and salads always taste better when someone else makes them.  I like the contrast between the very savory fennel and the sweet apples.  I also like the crunch topping on it.  We also ordered the mushroom pizza which was better than I expected.  The creaminess of the ricotta mixed with the pesto and oyster mushrooms made for a really nice blend of flavors.

We dined at Oakhart Social in early November and sat outside in the alley.  We were glad to be able to get a table without a reservation.  I'm not sure if they have much dining inside but they do also have a covered patio and offer takeout.",2718,635,view review
43,,Caitlin C.,21/12/20,,,,4,The brussel sprouts are AMAZING. The fried chicken was a little too salty in my opinion but the chicken itself was good quality. Overall the food is really good quality and portion sizes are generous. The Take-out menu has been limited (presumably because of covid) but it's still good,157,26,view review
44,,Nirali S.,16/01/21,1,1,4,4,"COVID Note: Staff was wearing masks and tables were adequately spaced. Wasn't too cold with the heat lamps.

Enjoyed our experience here! We were walking by and decided to check the place out since some tables were available. We ordered some light apps - brussels, carrots, and sweet potato. Everything was delicious, and the sweet potato dish was pretty unique. Quick and friendly service.",110,274,view review
45,,Sam S.,31/01/21,1,,,5,"The shaved salad and the burger changed my life. I might end up going back to Charlottesville solely to try out their other dishes! 

-A very satisfied DC tourist",20,164,view review
46,,Alison W.,28/02/21,,,2,5,"A great experience at Oakhart Social! Started the meal off with cocktails that were unique and delicious. Their menu seemed like ""comfort food"" with a twist. My husband and I got everything to share--and ordered the shaved salad, brussels sprouts, cabbage & scallion pancake, and the fried chicken. The shaved salad was light, complex, super tasty, and unlike any salad I've ever had (in a good way!). I highly recommend it. The brussels and pancake were delicious, and surprisingly filling for a veggie dish, and the fried chicken portion was also deceivingly big. We both left dinner very stuffed, and very happy.

In terms of covid-19 safety: social distancing was adhered throughout with all tables spread out greater than 6 feet. All staff wore masks the entire time, and they even asked that we wore masks when interacting with the waiter/waitress, which we were very happy to comply!",174,251,view review
47,,Michelle S.,14/03/21,,,,5,The carrots were to die for. Amazing! Loved this place.  Excellent service and cute ambiance,28,150,view review
48,,Emily S.,23/04/21,,,,5,"Wow. I thought this was a pizza joint but it's so much more than that. Divine food. Must try the charred carrots, cabbage and scallion pancake, and most of all the mushroom pizza. Incredible. Great service too! I can't wait to go back and try the rest of the menu.",94,137,view review
49,,Samantha H.,09/05/21,2,,2,5,"I was so lucky to snag a spot on Resy and experience this delightful meal. Our server informed us that the dishes were meant for sharing, so we were to order as a couple. He also gave great advice on drink choices, steering me towards the spring spritz, which was a delightful cocktail and, as he said, ""a lot of fun.""

The shaved salad received high praise online and I knew I had to have it. I love salads, and this didn't let me down. Peeled carrots and thin slices of apple and breadcrumbs(!!!) coming together with lightly dressed arugula was so texturally impressive, not to mention how well the flavors worked. I could eat the salad as a whole meal. The slivers of date brought such brightness. I kept trying to construct the ""perfect bite"" of salad with all the components, but every combination is its own treat.

I savored every bit of the tuna crudo. For me, the jalapeno was too much and overwhelmed my palate, so I only tried it with one piece. The citrusy sauce was so, so good, I was trying to sop up a good amount with every morsel of tuna. I want more.

Ramp is all the rage, so I chose the pappardelle dish over the xo carbonara which had also caught my eye. Again, a feat of flavors. Each noodle was perfectly coated in butter, and the pickled ramp were little bursts of joy. The oyster mushrooms were cooked to have nice deep flavor, and again, the textural variety was excellent, I loved the bits of walnut. 

This was a perfect early dinner meal, allowing enough time for an early evening stroll afterwards and maybe finding room for dessert. I would not come here if I was so, so hungry, because I had such good food that I wanted to be able to appreciate every bite.",210,24,view review
50,,Gina G.,30/05/21,1,,2,5,"This was my first sit-down dining experience in the COVID world and I couldn't be more pleased. My husband and I reserved outdoor seating. While the weather was cold and rainy, the outdoor heating lamps and the sweet little string lights made all the difference. The atmosphere felt welcoming and romantic. The food was delicious and exciting. One of the main reasons I picked this place was how fun the menu sounded. And the dishes we ordered didn't disappoint. The scallion pancake was our favorite bite of the evening. Service and staff were friendly and welcoming. Social distance among the tables outside was honored so even if I weren't vaccinated, I'd feel ok. It was, however, quite busy and crowded both indoors and outdoors. It was lively and exciting, exactly what I was looking for. Awesome experience, highly recommended.",109,153,view review
51,,Caroline E.,08/07/21,1,,2,5,"Eveything was absolutely amazing. Super fresh ingredients, well developed flavors, and great service. I enjoyed how they brought each dish out individually so you had time to enjoy, and all dishes came with large utensils for east sharing. Our server was also very helpful and the kitchen was very accommodating for my dairy free needs and prepared everything deliciously. 
The scallion pancake was probably my favorite dish of the night, it was light and almost crepe like abs had picked cucumbers and a delicious sauce on top  which were both unique and balanced. The snapper was amazing with perfectly crispy skin and had a very tasty tomato type sauce underneath. The strawberry fry pie was great as well, even though it was fried it didn't taste heavy at all and the strawberries were very fresh. 
Such a great meal, I highly recommend stopping by!",152,3,view review
52,,Courtni B.,10/07/21,,,,5,"OKAY!!! Traveling through Charlottesville for the weekend and stopped by here and Oakhart did not disappoint. Our server, Mandy was great, as was the other staff. Loved the 'social' aspect. 

We got the carrots, the sweet potatoes, and the pepperoni pizza. My only critique is that I wish the sweet potatoes had more of the whipped garlic 

Wish there was a restaurant like this closer to home, keep up the good work, Oakhart!!",41,12,view review
53,,Todd B.,14/08/21,1,1,,5,"On a weekend jaunt to Charlottesville, was reading up on restaurants that had a special something. We found ""it"" at Oakhart Social. Sharing plates was a great plus. Highlights were charred carrots which had candied walnuts and a sublime buttermilk dressing. Followed that with summer squash pizza and seared rockfish main course. Each dish was a tapestry of delights for the palate. I had the Mustang Sally Article One which nicely balanced the fish. 
How can those flavors be topped? Try the S'mores Bread Pudding - all of it heavenly. A top 5 of all time meal for sure!",71,2,view review
54,,Sandra P.,24/08/21,,,1,5,"I was excited to celebrate my husband's birthday dinner here. This place did not disappoint. We tried a little of everything on the menu. Our favorites were the cabbage & scallion pancake, fried chicken (the fish sauce vinaigrette is delish), and tuna crudo. Really wished this place was closer to where we lived because I would go every weekend.",186,27,view review
55,,Disha V.,18/09/21,,,1,1,Rude front desk staff. I couldn't make my same day reservation which their policy is call 24 hours head.d they charged me $100. Never going there again!! If you want To make money by cheating people more power to you!!,1,,view review
56,,Manny A.,14/10/21,1,,,5,Had a really great experience here! From the host being really patient with us even though we were late to the waiter and other stuff going out of their way to make sure we could get a vegan option for dessert. Thanks for the service and great food! We'll definitely be coming back!,6,9,view review
57,,Danielle S.,19/11/21,2,,2,5,"Really enjoyed Oakhart Social. We sat inside but they also had outdoor heaters under their tent. Very cozy feel inside. I wasn't expecting to be told it was a tapas style restaurant, honestly would have just ordered the pizza and loved it all the same! The pizza special was delicious and seasonal. The fried chicken was also really great. Portions are very big so I wouldn't go by the recommendation for about 2 items per person to order",121,70,view review
58,,Danniyal A.,11/12/21,,1,,5,"My wife and I booked a trip to Charlottesville for a bit of a mini-moon and popped into Oakhart Social for dinner the night we got in. From the moment we were seated to the moment we left the staff treated us like we mattered the world to them. The cocktails are delicious and well thought out, and the food was top notch (highly recommend the beets for an appetizer). Go here! You'll be delighted.",14,129,view review
59,,J E.,17/02/22,7,2,8,5,"Having seen and heard of Oakhart Social in the past, I knew this was something I wanted to try... so, I made reservations for a Wednesday evening for dinner. From the moment I walked in, thru dinner and until when I left, service was outstanding and very friendly and helpful! They do get quite busy, so be sure to make reservations!!

They have an interesting menu, loaded with some really nicely thought-out, well-executed smaller plates and entrées, all of which are quite large in size and shareable. They have a very nicely done cocktail list and their wine list is very good too.

The texture of their Little Gem salad was excellent and the flavors of the fresh greens and amazing, house-made dressing was incredible! Their fried chicken really isn't your typical ""fried chicken"" this one is much nicer and well thought out! For dessert, they have these smaller hand pies filled with pear which are awesome!

I really enjoyed this visit and will not only highly recommend coming here, I'll definitely be back myself!",2898,94,view review
60,,Arby A.,27/02/22,,,,5,"What a wonderful place. My fiancee and I come here for special occasions. In December 2020, we cam here for our anniversary and yesterday for her birthday. Both times, we were wow'd by the service, attention to details, and the delicious food. The set-up catalyzes great conversations, the idea of sharing food (tappas like but with larger plates) makes this experience much more fun. We will surely miss this place when we leave Charlottesville!

Thank you for making our special occasions that much more special!",3,,view review
61,,Allen P.,05/03/22,1,,,4,Cocktails were wonderful. The menu was interesting and most of the dishes were pretty good. They have something for everyone's palette. Service was on point despite the fact that they were very busy. We had a large group and they had no issue keeping up with us. Note that they do NOT split checks so if you're going with a group be aware.,221,97,view review
62,,M B.,20/03/22,1,1,1,1,"Hostess, rude as always it appears. 
We sat outside in the wind and cold because the hostess said, ""we have no other tables."" While a table in the middle of the restaurant sat empty for the entire time we were there.
Too much Mayo flavor on the scallion pancake
Pizzas were all great. Waitress was friendly and helpful.",8,,view review
63,,Brittain M.,10/04/22,,,2,5,"I have no idea why I haven't reviewed this place already. This is one of our go-tos in Charlottesville. We order the small plates most of the time. The carrots, scallion pancake, and fried chicken are our favorites. For some reason we always have an issue with the them forgetting to bring out the fried chicken or it getting delayed at the end of the meal. This doesn't diminish our love for this place though. They also have an excellent cocktail program with a good mix of sweet and less sweet drinks. One day I'll try their pizza...looks delicious.",87,39,view review
64,,Zachary S.,08/05/22,2,,3,5,"In my opinion, this is the best restaurant in cville and there is only a single close competitor.  Their fried flounder special is insanely delicious and always well prepared.  I would say they are hands down the best pizza in town.  Service is always incredible and top notch, and they always have an interesting cocktail selection.  Katie is always the waitress who serves us and she always remembers our orders and is never too busy to actually go back to the kitchen to clarify on a menu items ingredients or preperation.  Simply the best place and the fact it is always completely booked just proves my point.",19,22,view review
65,,Nicole K.,31/05/22,,,,5,"great place for dinner, definitely on the pricier side for college students but worth it for a nice outing. the beets were amazing, scallop crudo was okay, and the flank steak was wonderful. the s'mores bread pudding dessert was phenomenal. will be returning",3,8,view review
66,,Amy S.,12/06/22,1,1,1,5,"We had a wonderful meal and experience at Oakhart Social on our recent visit to Charlottesville.  Our server Vera was probably the highlight of our experience but the fried chicken and ricotta toast was a close second.  The approach to the menu is farm fresh and shareable and the atmosphere is casual but gourmet. Vera was so kind and excited that we were visiting her home town that she sent us off with a list of recommendations for dining, drinks, and shopping. Southern hospitality at its finest!  We look forward to a return visit the next time we are in town.",113,1,view review
67,,Sarah D.,23/07/22,,,,5,"So much yes. Service was slow but worth every moment, be patient I promise it's worth it. For appetizers, Peach & Shishito Toast was amazing, perfect peaches and the ricotta balanced the sweet and the pickled onions. The wood fired oysters were perfectly cooked with a light seasoning and perfect amount of toasted panko. Hanger steak with chimichurri was perfectly cooked, with a light aioli that paired perfectly with the potatoes. Sausage pizza was amazing, good crunch to the crust and the sausage as fresh and tasty. Didn't even have time to take pictures we pounced on it so quickly. Finished it all off and while we are full, it's a happy full due to fresh tasty food as opposed to heavy. Can't wait to come back and it's a 3 hour round trip.",53,30,view review
