,,Author,Date,Cool,Funny,Useful,Rating,Message,Author Reviews,Author Friends,(view source)
1,,Kimi S.,06/05/15,7,5,10,4,"Maybe it was the twinkling lights or the exposed brick walls or perhaps the garage door windows but I felt a welcoming warmth rush over me as soon as I walked in.

The menu was explained as small plates but most definitely NOT tapas because they were served as they came out from the kitchen and not all at once. This concept was definitely lost on me since I'm pretty sure that is exactly what tapas is...but I digress....

Everything on the menu looked absolutely fantastic so whittling down our choices was quite hard. We decided to go with (almost) ALL of the things!

Roasted beets with ricotta cheese - Nature has never tasted this good before
Roasted brussel sprouts - I'm a huge fan of brussel sprouts but I thought this was okay. The sprouts should have been roasted a bit longer to caramelize and get tender and this strongly tasted of fish sauce without any other flavor.
Scallop Crudo - A generous portion of the most tender, sweet scallops I have ever tasted. It took every bit of will in my body not to snatch all of these at once.
Grilled octopus open faced sando - The garbanzo puree on the toast was simple and delicious. I'm definitely going to be incorporating this into my sandwiches at home. That being said, the octupus was overcooked and rubbery and tasted like char. 
S'mores Bread Pudding - The most inventive bread pudding I've ever seen. I loved how all the slices tasted like brownie ends and the bruleed marshmallow was just perfection.",2041,5000,view review
2,,Shelly N.,25/02/16,,1,2,4,"Service: 5.0/5.0
Food: 3.5/5.0
Overall Experiene: 4.0/5.0

TL;DR: order the shaved salad, wood fired oysters, sweet sticky pork belly and pork shank. Could get better food else where for the price but the atmosphere and customer service made this place worthwhile. Not sure I would ever come back here though.

For those beer & wine lovers: there's an extensive menu and seasonal specials. 

We ordered the following:

Shaved salad: It always seems a little silly to me to go out and order a salad, but you can't go wrong with this salad! There's so much flavor to this salad and the combination of items was brilliant. There was a lot of dressing on the salad and I absolutely hate salad dressing but everything for this dish worked. Highly recommend this item!

Wood fired oysters: Definitely do not like oysters because of the taste and texture. But Oakhart made this work in every single way! The flavor was light and not very ""oyster"" like and there was a brilliant crunch from the crumb. This order comes with four oysters, so make sure you order according to your party size. 

Oyster Mushrooms: Mehhh. There wasn't anything particularly special about the flavor of this item for me.

Provoletta: If I did my visit over, I would definitely pass on this item. The bread for the make your own ""pizza"" is a bit too wood fired cooked for me. In addition, the bread had a lot of holes when it was baked, so there wasn't a lot of a bread filling. The provolone and goat cheese combination wasn't my favorite. 

Chicken wangz: Would not really recommend this item. The cream sauce was the same one served with the shaved salad but it did not go well with the wings to me.

Sweet & Sticky pork belly: Solid order but this wasn't the best pork belly I've ever had or something that really stands out to me. Definitely a good amount of flavor and would recommend but is not something special.

Chili lime roast shrimp pizza: My friends and I agree that this pizza tastes like any regular pizza but the difference for Oakhart social is how well the pizza was cooked. You can taste the smokiness of the pizza and the crust was fluffy yet soft. The texture and consistency were good but the flavors of the pizza was just whatever. 

Pork Shank Special: The pork fell off nicely and was cooked super well. It was delicious but I was kind of confused with the pairing of items. The pork shank was served on a pile of some sort of grains that I can't recall what it was?  There was also a yogurt cilantro to pair with the pork and I wished they stopped there. The combination of the Indian taste like grains and American meat was odd but would have been yummier without the grains. Still a solid order though!

Overall: The rustic atmosphere of brick wall, dimly lit light and excellent service made dinner very pleasant! Unfortunately, I'm not sure Oakhart Social is a place I would come to again but it was definitely a fun experience. My biggest beef with this place is probably the pairing of items - the combination just didn't work for me. There's an outside eating area that would be nice for when the weather is warmer.",56,348,view review
3,,Onvara A.,10/02/17,,,,4,"My friend and I came here for dinner and ordered the Brussels Sprouts (with Korean chilli, aioli, and crispy shallots) and the Marinated Mushrooms & Black Kale Pizza (with garlic potato cream and parmesan). 

The pizza was one of the best I've ever had! The garlic potato cream was an amazing touch. The brussels sprouts were a little disappointing though, as they were very salty. I've seen other great reviews for the brussels sprouts so I think it was just an off-night for them, but I'd recommend ordering the aioli on the side just in case. The crispy shallots on top almost made up for the saltiness though.

Service was good and they have a private parking lot right next to it! That was a major plus for me, especially since it's so hard to find street parking in the West Main area.

Also, the menu they have on their website is not completely accurate. There were a few dishes that didn't appear on the menu in the actual restaurant, but there were still plenty of delicious options.",619,41,view review
4,,Sean P.,05/03/17,,,1,5,"Dang, I like this place. 

Built out of an old three stall auto shop, this restaurant/bar doesn't try to hide it's history. I believe the original renovation was completed by a restaurant that failed. Oakhart took over and while I'm not sure on what they changed, the end results are great. The two stalls on the left still have their garage doors, but replaced with French doors connecting their dining patio. The patio makes the best of its space and stretches across all three stalls. It is lit with overhead hung oversized bulb lighting, which gives it a nice ambiance. The bar takes the space of the stall on the far right. About ten seats at the L shaped bar.

I've sat at the bar every time I've been here and it has suited me just fine. They do encourage drinking here, so if that's on your list, you'll fit right in. They have quite a large wine selection. I just tried to ignore that page of the menu!

The brussel sprouts were an awesome appetizer. I also enjoyed the crispy lamb shank tremendously. It was served on a bed of sunflower hummus, which I had to cut back on trying to stretch it with my lamb. I also tried other dishes and was not disappointed.",162,51,view review
5,,Steacy L.,01/10/17,,,,4,"Incredibly good food. Try the sweet/sour eggplant- that was a standout. The smoked oysters were delicious but a very small option. 
If you're looking for a drink, order whatever's in the slushee machine.",60,7,view review
6,,Ashley V.,03/10/17,1,1,3,3,"I came here on a weeknight after a long day of classes and was ready to feast. I heard so many good things about this establishment and have driven by several times telling myself that I needed to try the place out. The place looks so promising with their cute decor and natural lighting, but it just didn't deliver to the hype. 

I tried the mushroom grits, octopus oyster mushroom pizza, and the margherita pizza. The mushroom grits were...interesting. The grits were actually quite tasty and creamy; however the mushroom was kind of weird. It was larger, tart, and had a bitter char on it. I wasn't the biggest fan. It came with garbanzo beans that were yummy, but the whole dish had this interesting Indian flavor. For 13 dollars tho, I really don't think it was worth it. Our server recommended the octopus mushroom pizza and since it sounded different we decided to go for it. The pizza had  a good thin crust, but it was actually quite burnt so there was a slight bitter taste in each bite. Ironically, it got soggy quickly even though it was burnt. Thank god for the margherita pizza. It honestly saved the meal. It was actually so delicious and was a decent size. The basil on it was so fresh and everything was perfect. 

The biggest disappointment about this place was how everything was served ONE AT A TIME. I get it but man they really could not work with us because we were starving. They waited for us to finish each plate before presenting us with the next one. The problem was we didn't intend on sharing our plates like a tapas style meal so it was pretty annoying. I really don't think I would come back...idk maybe for drinks. Overall, I wouldn't give this place more than 3 stars just because it was pricey, the food wasn't that great, and the portions were wayyy too small.",196,433,view review
7,,James T.,09/11/17,3,,3,5,This place is great! Came here with the family and they had something for everyone. Would definitely recommend a cocktail with their crazy ice balls! The outdoor patio is great as well.,97,120,view review
8,,Angel H.,15/02/18,1,,2,5,"Came here yesterday for Valentine's Day dinner and had a fantastic time! Service was impeccable and the food quality was great. Just as a side note, reservations required a $50 deposit for Valentine's Day. 

First off, I loved the interior design and ambiance. The lighting is warm and cozy and the tables are well arranged to maximize numbers yet provide enough intimacy. The bar is not big but there's a little ""socializing area"" between the dining area and the bar where people gather and chat. I thought that was a cute design! The restaurant does get a little loud so sometimes it can get hard to hold a conversation. 

For the meal, they started us off with complimentary champagne- a nice surprise for the night. The plates are meant to be shared so they serve the dishes as soon as they come out. My boyfriend and I got the shaved salad, the hanger steak, and the ribs. 

The shaved salad was beyond amazing. I don't even know all the different vegetables and fruits they put in there, but the combination was magical. The crumbs on the top combined with the sauce give the salad such a nice crunch as well as a rich, tangy taste. Most highly recommend! 

My next favorite dish was the onion ring and ribs. The BBQ sauce and aioli sauce were so delicious! The ribs were well smoked and very meaty. The portion size was also quite large, definitely enough for two. 

The hanger steak was good, too, but did not quite match up to my expectations. It was definitely too well done and too tough for a ""medium,"" and it took a long time before we got it. The potatoes that accompanied the dish were fabulous though- crispy and well-seasoned! 

Oakhart Social is a wonderful restaurant that serves high quality, unique dishes. It is pricey, but you get what you pay for.",510,454,view review
9,,Alice M.,16/03/18,,,1,4,"This place is very good! The best way to do it is to go with a group and share so you can sample lots of different dishes. My favorite items thus far have been the shaved salad, ricotta toast, squash tortellini, and bread pudding. I am generally anti-salad so the fact that the shaved salad made it into my top dishes list shows just how good it is. 

A lot of people love the brussels sprouts here too but both times I've had them they were a bit undercooked. The catfish was prepared well but wasn't ""Nashville Hot"" as advertised. 

Overall, the quality of food here is quite high. The main reason I don't want to give 5 stars is because their cocktail menu is lacking-- it's all gins and whiskeys. I don't know why it is so hard to find good tequila cocktails in Cville! They also make you put in a credit card if you are reserving a table online, which is kind of a bummer. Still would definitely recommend checking Oakhart out for your next date night or small group dinner.",170,231,view review
10,,M. Spencer H.,15/04/18,,,,5,"We had an impeccable server. We arrived shortly before the kitchen was closing so they made sure to prioritize ordering food and were helpful in recommending selections. I recommend the tortellini, that sauce is divine. Their bramble cocktail is officially my new favorite cocktail in Charlottesville. It is light, sweet (but not overly so) and refreshing! I can't wait to come back and try more of the menu.",211,26,view review
11,,Nina U.,21/04/18,1,,4,5,"Boom. This is my kind of town and my kind of restaurant. We found parking in a little lot and stopped in a couple of bars along the way until our reservation was ready. They only had a late 8:30pm opening but it was so worth the wait. I cannot pick my favorites, they were all tastebud-awakening.

- Shaved Salad
- Grilled Octopus
- Chicken Wangz (my least fav but still delicious)
- Fried Catfish (we were so full by this point)",1060,699,view review
12,,Thuy H.,27/04/18,,,3,4,"I learned a few things from my recent experience at Oakhart Social. The biggest take-a-way I got was that this place offers a tapas style dining experience and if you aren't going to eat your meal tapas style, you probably won't enjoy it. I ate at this restaurant a while ago and everyone at my table got their own entree (no sharing at all) so we all did not have a great experience. However, when I came here recently and had a tapas style meal, it was an amazing experience! 

The server recommended everyone at the table getting 2-3 dishes to share. Sharing was a great way to try all the small dishes at this restaurant. Here are a few items we got:
-Shaved Salad: This sounded just like an ordinary salad but it was so good. Definitely one of the best salads I've ever had. Get this! 
-Wood Fire Oysters: I loved the citrus gremolata on the oysters. Also, the bacon fat really tied this dish together. 
-Roasted Beets: I'm not a big fan of beets so this dish wasn't that great for me. The beets tasted pretty bland- just boiled beets basically.
-Pate: Surprisingly, the pate was really good on the toasted, crunchy bread that it came with. I usually don't eat or like pate but it was pretty good.
-Grilled Octopus: I really liked the octopus! It had a charred flavor and the texture was nice.
-Chicken Wangz: GET THIS. I loved this dish. The chicken wings are so savory, crunchy, and just perfect. 
-Hanger Steak: The steak was super tender and flavorful. I loved the fried potatoes that came with this dish. 
-Fried Catfish: This was also one of my favorites of the meal. The catfish was moist and the breading was so crunchy. 
-Five Cheese Garlic Pizza: Very creamy and really crispy! 
-Pot de Creme: A solid dessert. The creme was smooth and indulgent. 

Overall, my dining experience was memorable. I'd highly recommend this restaurant if you're looking for a unique dining opportunity. If you despise tapas stye, don't come here.",222,186,view review
13,,Ilonachka N.,27/04/18,1,,3,5,"This is my new favorite restaurant at Charlottesville.

I came in on a Sunday with a few folks and absolutely LOVED the food here. I can't rave about it enough. I am vegetarian, so I stuck to the appetizers and the five cheese garlic pizza (which was phenomenal). In addition, the carrot appetizer is absolutely INSANE! I could eat five of those instead of a meal E-A-S-Y!!

Highly recommended to the community!",398,989,view review
14,,Sarika P.,01/05/18,1,,3,5,"Absolutely love this place!! It is located right next to Public Fish & Oyster (also another amazing restaurant!) and has such a great ambience. I heard that they recently renovated the restaurant to open up a bit more space, so I am hoping to go one more time before I leave Charlottesville! 

Some of my favorite dishes include: roasted beets, wood fired oysters, chicken wangz, roasted squash tortellini, hanger steak, and crispy lamb shank (YOU MUST ORDER THIS DISH).

The crispy lamb shank is probably the best dish of the restaurant, with the meat cooked perfectly well -- super juicy on the inside and crispy on the outside. I think the process of cooking the dish takes a while, so they limit to ordering it until 9:30 PM.

Two of my favorite drinks were the Flora and the Bramble On (both gin based), and they have a variety of great cocktails to choose from. 

Overall, a great place for a date or group dinner!",31,839,view review
15,,Clayton R.,26/06/18,,1,1,5,"A great find in a city full of great finds!

I sat at the bar in their super comfy and Uber-hip red bar chairs and was very well taken care of by the friendly bartender.

I had the Tuna Crudo as an app (pictured), which included some legumes on it as well....a first for me, but they pulled it off.  The flavors matched very well for a delicious, light appetizer.

For the meal, I took the bartenders suggestion for the pizza special, which was a work of art and also wish I unfortunately forgot to photograph in my excitement to get started.  It had pickled tomatoes, squash, onions and a delicious cheese blend to match an equally delicious crust.  Perfectly cooked and I savored every bite!

In a great food town, this place definitely rises to the top and I'll be returning next time I'm here.",152,29,view review
16,,April H.,28/07/18,1,,2,5,"My family really enjoyed our dinner here. We came on a Friday evening around 6pm, and we were seated at the bar, which has full service. My sister and I shared the chicken wangz and the margherita pizza. The chicken wings were slightly spicy with a faint mustard taste, which sounds kind of weird but was very good. The pizza was thin, crispy, and freshly made. Not overly filling, but just what you expect a margherita pizza to be. My parents shared the wedge salad, grilled octopus, and seared snapper. They thought everything was great, but they loved the octopus. Our server at the bar was attentive and pleasant. I would recommend Oakhart Social for a nice dinner with family or friends!",190,61,view review
17,,Lauren J.,09/10/18,,,1,5,"Ok my mom and I are visiting from California. We were initially going to go to the Public Oyster Bar place, but they only had bar seats and the restaurant was freeeezing. So they directed us to Oakhart Social. And omg. I'm so glad they did. Oakhart has shareable plates so you can order 2-3 things on the menu to try. My mom and I got the grilled octopus, the lamb ribs, and charred carrots and y'all. It was amazing! Such cool flavor combinations and everything was fresh. According to the menu, they also buy from local farms, which is a plus. Then we got desserts that were so delicious - s'mores bread pudding and pot du creme. Not too sweet and the perfect size. 
Good drinks too! 

If y'all are in the area you should definitely stop by! Wish I could come here more...guess I have to visit Charlottesville again!",9,223,view review
18,,Ira S.,12/11/18,,,,4,My wife and I enjoyed this restaurant.  We had many of their small plates and enjoyed all of them.  The one thing that I've noticed about restaurants with small plate menus is sometimes the choices don't really appeal to me and I find myself boxed into a corner with choices.  We did enjoy what we ordered.,157,19,view review
19,,Moonraker069 -.,16/12/18,,,,5,"I can't even begin to describe the flavors... an explosive melange of flavors... from spices, vegetables, and meats and fish (if you choose them). My mouth is experiencing a culinary thrill. Wow. 

Seriously. Everything we selected was good! Where do these wonderful chefs come from??  They always show up in the most obscure places. 

I am not kidding.... you have to come here. Be patient. The crowd and line are long. But the meals are worth it!",20,1,view review
20,,Allison M.,12/02/19,1,,5,3,"Not bad overall! I think all the food was executed well, but didn't hit a 5/5 in terms of blowing me away with flavors. I do love ordering tapas style, but always struggle with getting the right amount of food. It's a bit on the pricier side as well.

We got wood fried oysters, chicken wings, brussels sprouts, and pepperoni pizza. The oysters were my favorite for sure - I wished there were more. There was a great flavor with the bacon fat and citrus-y crumble on top. The wings and sprouts were both solid, but again, not the best I've had for either, but I've developed my own personal tastes for these foods. The pizza - I came in with high expectations because people love this. There isn't much pizza I don't like and this one wasn't an exception, but I just think it could have been better.",400,498,view review
21,,Tiffany L.,19/02/19,1,,2,5,"I came here after making reservations for a party of 6 on a Saturday night. They share a small parking lot with nearby shops and the inside of the restaurant is also rather tiny. (Don't bring your kids here!) However, these small complaints paled in comparison to how delicious (and inventive) the dishes were! 

It was great having 6 of us there because it meant we got to sample a decent amount of the menu which is designed as small to medium plates to share. Everything was great but the real standouts that I'd say are MUST TRYs would be: ricotta toast, squash (yes, squash!), the lamb, and the bread pudding. Wonderful and distinct flavors and textures.

This is currently my favorite restaurant in C'ville!",1365,139,view review
22,,Craig E.,04/03/19,2,2,2,1,"My girlfriend and I were so excited to try this place, but the service and food were such a disappointment. The restaurant was completely empty when we arrived, but we were seated next to the only couple at the restaurant. We wouldn't have cared but our tables were literally a few inches apart and there were plenty of open seats everywhere else. Our waiter, Collin was subpar and didn't really wait on our table the entire night. He took our order and checked up on us once throughout the dining experience. 

For drinks, we got:

Eloquent Bastard: this smelled like soap or some kind of detergent. I had to hold my breath to drink it and it was far from good. Half of the drink was foam. 

Pineapple 22A: this tasted like straight liquor mixed with burnt pineapple juice. 


For food we got:

Beets: This was nothing special. It tasted like beets from a can. 

Squash: This was the best part of our meal and that's saying a lot. Again, nothing special. 

Octopus: Half of the octopus was burnt and completely inedible. 

Swordfish: This tasted like something you would get from the frozen aisle of the grocery store. The fish had no flavor and it was very dry. The accompanying sauce tasted like a cheap honey mustard. The garnish was pieces of bitter lettuce. 

We were so disappointed we wasted a $100 at this place. Save your money and go somewhere else with better service and food.",37,24,view review
23,,Sol A.,22/03/19,2,,1,4,"I will give them a resounding 4.5 stars for their service, the octopus, the beets, the charred carrots, and the fried chicken!.
The service was fantastic. The octopus was amazing but I must say the portion is rather small but such is the concept of Oakhart social. 
Don't leave without the desert s'mores. Quintessentially American but with a nice Twist!!",198,39,view review
24,,Chris N.,26/04/19,,1,,5,"This story begins, as the good ones do, with an impeccably-dressed gay man.

My wife and I are farmers and don't get out much. But somehow, the three or four times we've come here, a new and impeccably-dressed gay man has complimented my wife's outfit. I'd been previously unaware that the fashion opinions of said men carry enough weight with cishet women to inhale the light of a collapsing star, but damned if I didn't learn something new that first time. 

She was a happy lady after leaving Oakhart Social. We didn't have any children the first time we went, and now we have two. I'll leave it to your imagination/nightmares to put two and two together.

Even if all the above didn't happen, the food is still worth five stars. I never had anything here I didn't want a whole lot more of. The pizza crusts are so good, they're worth stealing out of the kitchen*. My dad - a septuagenarian who sometimes pretends to forget my name just to mess with me - never fails to recall exactly how good Oakhart's lamb shank was, and then immediately thereafter yell at me for being a livestock farmer that does not raise sheep, which is true, for the following reason:

Cousin: ""You uh... you ever gon' raise sheep?""

Me: ""We probably will. Just not yet.""

Cousin: ""Mmmhmm. When you get em... you gon' $%@! em?""

Me: ""Jesus man... not all of em.""

Full disclosure: They buy a pig loin from me every now and again, but I'd legit leave this exact same review even if they didn't. But they did, so you can eat there secure in the knowledge that a.) the food is on point, 2.) at least some of the pork they offer is helping restore riparian buffers in the Northern Neck of Virginia, and 3.) you're indirectly helping me feed the two kids I only have because I ate here a few times.

*Don't do it. They have knives.",17,81,view review
25,,Zhana E.,30/04/19,4,1,3,5,"Loved this place! I've been a few times and I've enjoyed myself every time. The service was on point. The food was great and different. I had the pizza special and it had a very different combo of flavors, but they all worked well together! 

The ambiance is great here! Even when the place is packed you can still have a conversation. 

Try to make a reservation though, you may not always be able to get in.",114,186,view review
