,,Author,Date,Cool,Funny,Useful,Rating,Message,Author Reviews,Author Friends,(view source)
35,,J H.,28/08/17,,3,3,1,"Sunday brunch.
My wife, 10mo, and I were seated outside around noon.
Two other tables were outside and were about to finish.

Given waters then 4 more tables were sat after us and orders started to be taken before ours.

Wife complained to one of the hostesses/ waitresses, she acknowledged then went to go take orders at another table.

Asked to speak to a manger and was told there was no manager on.

Told that bartender was in charge.  Told bartender that we were leaving because they had skipped over us.

No response.

Waiter, 2 waitresses, and bartender - Caucasian.
We are not Caucasian.

Terrible service, will not return.",8,3,view review
36,,Angel H.,23/09/17,,,,5,"Loved Petit Pois! Excellent food, great service, and romantic atmosphere. The indoor seating is limited, but there's plenty of tables outside in the patio. The servers were attentive and friendly. Always asked if we wanted more bread and refilled our waters frequently! Service was also pretty fast. 

The wine was fantastic! I got the RosŽ Merlot 2016 and it was delicious. Fragrant but not too sweet- has a nice refreshing feel to it! The arugula salad was amazing. The dressing was perfect and so was the amount of shaved parmesan cheese. The pine nuts also added a really nice flavor. I got the Lamb Ragout and liked it a lot. The potato gnocchi was chewy and the smoked lamb was juicy and tender. The sauce was amazing! It was rich but not too greasy or salty and it paired so well with the gnocchi. My boyfriend got the steak and frites and really enjoyed it too! The steak was perfect medium- the outside was crunchy and the inside was super soft and juicy. 

A great place to get dinner! The restaurant has such an intimate, romantic feel to it and the piano jazz music they play is great. People are well dressed and the servers are awesome. My only complaint is that they do not validate parking.",510,454,view review
37,,Kelsey L.,24/10/17,,,,3,Service sucked - bread drinks and entree all came out at one time...  but food was absolutely divine! Loved the patio and we were able to get a seat on a busy Saturday night. Bathroom was pretty gross with tons of flies.,100,50,view review
38,,vivian r.,25/01/18,,,,3,"My roommate and I came here after watching Saul Williams at the Paramount Theater. It is less than 100 meters away so it is a great choice for dinner after or before a show there.  It was restaurant week.  I can't remember what I had for an appetizer.  I had the coq au vin for my entrŽe.  It was really good. I had the cheese dish for my dessert course. It was just okay.  It was really a small and cramped space.  So, that also contributed to the rating. Overall decent meal.",339,64,view review
39,,Sonia B.,13/03/18,,,,5,great food!! the brussel sprouts were perfect and the staff is very considerate of dietary restrictions and accommodating in like many other restaurants. Very good vegan and vegetarian dishes,2,,view review
40,,Reilly S.,03/04/18,1,1,1,4,"Overall, I really enjoyed Petit Pois and highly recommend trying this French-style restaurant. While the fare is a bit pricier than other selections on the Downtown Mall, PP really is a step above the rest. The decor is intimate, but rustic, with a countryside interior and a nice outside deck. As the weather cools down in the late afternoon and early evening, the deck gives a nice view of the mall, perfect for a glass of wine with friends and family. The menu offers a variety of food items, with each dish built around seasonal, fresh ingredients. Each dish our group ordered highlighted local ingredients and demonstrated a deep attention to detail. Bellow is a description of the dishes I ordered:

Coq Au Vin: While I typically steer away from ordering chicken at restaurants, this bird was cooked beautifully. The meat was moist throughout and nearly fell off of the bone. The resulting wine sauce had a deep, rich flavor with a nice saltiness. The mushroom and carrot lardon on the top complimented the meal really well, adding nice earthy and herby flavors to the dish. The buttery, purred potatoes were also well executed, providing a great base to soak up the complex flavors.

Side of Brussels Sprouts: These were fantastic; the sprouts were really well roasted, crispy on the outside and buttery on the inside. The parmesan on top added a great saltiness while the bacon offered a rich hearty tone to the meal. The portion was very generous for $5 and ranks among the top in Charlottesville. Might come back to just order wine and a side of these!

Would definitely recommend going to Petit Pois. While the place is a bit small, the food is really well done and offers a nice deviation from the typical American/Southern food found on the mall. The waitstaff was very helpful and the ambiance relaxing and inviting.",101,608,view review
41,,Conan O.,14/04/18,,,,5,"One of the best brunch spots in town, especially when the weather allows outdoor seating.
Inside is super cozy -- some tables a little too cozy -- but in good weather this is our go to spot

The Benedict is outstanding as is the Shrimp and Poached eggs

Bacon is meaty and always well cooked and the herbed potatoes are amazing -- unless they over herb them then it can be a bit much",82,18,view review
42,,Jennifer S.,23/04/18,,,,4,"Lovely location and terrific service. The staff couldn't have been better or more accommodating. The gnocchi lacked flavor, but the arugula salad was delicious.",209,50,view review
43,,Victoria G.,12/05/18,1,,1,5,"Very nice lunch, great ambience and good service. Both the lunch (gnocchi, risotto, and trout) and dessert (chocolate mousse) were delicious.",15,344,view review
44,,Mariyam D.,28/05/18,,,,5,"Visiting Charlottesville for my birthday. While strolling, we cane across this restaurant. French cuisine and reasonably priced. We ate steak tartar, burger, lamb ragout, and hazelnut chocolate mousse. Everything was delicious and will definitely come here again next time we are in town!",3,5,view review
45,,Anthony F.,17/06/18,,,,3,Well after debating for a while we decided to dine here however we were not impressed by the food. Everything seem to be oily. Out of for dishes we enjoyed the kale salad only. Not joking. They can do better for having great location and setup,7,,view review
46,,Novianti B.,23/07/18,,,,5,"My husband and I favorite lunch spot at the downtown mall. Perfect portion for lunch, i love the salmon and mussel dish. We asked for extra bread so i can dipped it into my mussel jus/soup. Highly recommend this spot",240,7,view review
47,,Cassie P.,01/08/18,11,2,9,3,"There's something special about Main Street in downtown Charlottesville and the wide array of dining options is certainly part of that! On one particular evening, I was in the mood for some French food and landed at Petit Pois. 

I was alone and opted to sit outside on the patio where the hostess gave me a hightop table close to the action. I ordered mussels, French onion soup, and a glass of wine. Overall, it was a-ok but didn't leave me wanting to come back for more. I was particularly letdown by the French Onion Soup. Not sure if it wasn't hot enough or what, but the cheese was a strange texture and I found it all rather bland. The mussels were more flavorful but didn't have a ton of broth to soak up with the bread which is usually the best part! 

I don't know if it was because I was by myself, but the service could've also been better. I was there for a full meal but found the waitress to be inattentive and she didn't let me know of specials which I ended up overhearing her tell neighboring tables later on in my meal... It was my first time at the restaurant so a little more warmth would be appreciated and I would've also probably got dessert but didn't want to overstay my welcome.

The nice patio, people watching, and wine made up for some of the misses. I wouldn't completely discount returning here in the future to maybe try some other dishes, but I wouldn't come back alone.",1843,4027,view review
48,,Kat W.,23/08/18,,,,5,Wow can't say enough about this plane. Great atmosphere and service. Great prices and selection. Got the duck and sparkling champagne.,24,4,view review
49,,O R.,04/11/18,,,1,4,"Warm welcome, excellent attentive but unobtrusive service and a varied and interesting menu. The mussels and chicken liver pate were were flavorful. The hanger steak was perfectly cooked to medium rare- tender & tasty with real Pommes Frites and gravy, and the seafood stew was wonderfully seasoned and prepared. This was a pleasant meal in an intimate milieu.   ""Petit"" is not a misnomer- recommend that you present early or make a reservation.",113,,view review
50,,Grace V.,26/01/19,,,2,1,"We were very disappointed when we arrived at our reservation time for dinner last night. We were told there was a ""miscommunication"" and was offered outdoor seating because there weren't any available tables. Considering that is was 30 degrees outside, this was not a realistic option (even with the heat lamps we were promised). I would have appreciated an apology rather than being repeatedly told that it was a misunderstanding. What exactly did I misunderstand? We weren't given another time and the hist awkwardly stood next to us until we left. This was horrible customer service and poor organization. Sorry, there are too many restaurants in C'ville to settle for that level of service.",7,,view review
51,,Ricardo S.,18/04/19,,1,,5,"I'm a vegetarian, and I can tell when the meatless dishes are just an afterthought.  These were not.  The risotto was cooked perfectly, the gnocchi had a light sear on it (which we all know is superior to just boiling it), and the sauces were vibrant.  And the beet salad was one of the best I've ever had.  Add an elderflower soda to the meal, and there is no way to NOT give them 5 .  As the French say, boo-ya.",3,,view review
52,,Ryan K.,06/05/19,,,,5,"Great brunch on the Downtown mall! I ordered the smoked salmon tart. I enjoyed everything about this dish: the potatoes, the cream cheese, the salmon, and the greens. The brunch prices were very reasonable relative to the portion size. I would highly recommend Petit Pois for brunch.",674,21,view review
53,,Jacob S.,06/05/19,1,,1,4,"The food we had was great, flavorful, well-seasoned. I was a fan of the Lamb Ragout Gnocchi, especially its sauce, even though the lamb was cooked in a way I was not expecting (cubed and a little dry, when I was expecting shredded and moist). I kept wishing for more bread to soak up the sauces of my party's other dishes. 

They did allow our dog to hang out with us which is a huge plus. It was also not terribly expensive for dinner, around $150 for four people with a bottle of wine. 

The only reason it's not a 5 star review was because of the service. It was pretty slow for a Friday night (outside seating full, indoor restaurant empty), but the wait staff still forgot things we asked for and did not check in with our table often enough.",37,21,view review
54,,Heather M.,20/06/19,,,,5,"This restaurant is AMAZING! We are from out of town and ate here six years ago. Since then we kept talking about it and how wonderful it was. So when we came back to C'ville we were thrilled to get to go back. And it did not disappoint! The cheese plate is particularly transcendent! The mussels, frites, chicken, linguine-- it was all amazing and we found ourselves eating off of each other's plates. And while it is classy and not great for kids, they were very accommodating of our kids both times. Don't miss this fabulous restaurant! It's beyond great!",10,,view review
55,,Jackson B.,25/07/19,,,1,5,"One of Charlottesville's best kept secrets is lunch/brunch at Petit Pois. Not a plate over 15$, while still providing the ridiculous level of technique and flavor you'd expect from the dinner menu or even the sister restaurant Fluerie. Amazing for any meal, but the value of brunch is unmatched. 5$ mimosas and 13$ for the best plate of poached eggs and hollandaise I've had in 2019? Yes please.",18,340,view review
56,,Phil T.,08/08/19,1,,1,5,Tonight we had another fabulous meal for our 37th wedding anniversary. Sophie you're a fantastic server. Thank you so much for your kindness. We couldn't have had anyone more wonderful to serve us tonight.,31,70,view review
57,,Rita P.,21/08/19,,,2,5,"Simply delicious! I would recommend for a nice evening out or cool date night. The food is fresh, inventive, French, colorful and unique. Sit on the patio or inside, you'll enjoy you're time at Petit Pois.",194,246,view review
58,,Kate Q.,31/08/19,,,,5,Great service and food! The vegetable risotto was amazing and the lunch prices are very reasonable.,22,,view review
59,,Lila P.,07/09/19,,1,1,3,"The specials we ordered were way better than the entrees listed on the menu. From the menu entrees, we got linguine bolognese, gnocci w/vegetables, and smoked lamb. The pasta noodles were soft, lamb was a bit gamey, and the gnocchi with the sauce was bland. They all just tasted flavorless. 

However, the specials were on the other side of the spectrum. The crab cakes dish were seasoned while the pork tenderloin special was tender and juciy. Why the difference? I have no idea. 

So if I come back next time, I would ask for the specials and order those dishes.",410,1,view review
60,,Jennifer A.,09/09/19,1,1,1,5,"Do yourself a favor and get the smoked salmon and poached egg for brunch! It is seriously life-changing. The dish is made of a potato pancake, salmon cured with gin, a salad of endive and chicory, cream with dill, and of course the poached egg. The flavor of this dish will knock your socks off!",12,97,view review
61,,Eric H.,24/09/19,,,,5,"the ambiance was perfecto! exactly what we were looking for, an outdoor active croud.
we started by telling our server that my wife needed gluten free. she responded telling us that she had celiac. we've never had a server that was so on our side and knew what we needed.
the meal ended up being perfect!
we highly recommend!",3,10,view review
62,,myin t.,07/10/19,,,,4,"Rani, the black rabbit, may want to reconsider the service industry. Food was okay, but with poor service,  nothing tastes good. I believe in service recovery, and Rani made a valiant effort to address our dissatisfaction.",11,,view review
63,,Luis A.,03/11/19,,,,5,"By far, one of the best restaurants in Charlottesville. I studied cuisine in Paris and the food here is every bit as good as a fine French restaurant.  The staff is warm and inviting and the service is always attentive.  A hidden gem that, this review notwithstanding, I hope stays that way!",1,,view review
64,,N L.,08/12/19,,,,5,"Delicious coq au vin, friendly service, unbelievable value, cut little dining room, and I'm sure the outdoor seating is wonderful in the warmer months. We'll definitely be coming back next time we're in town.",16,,view review
65,,A P.,08/12/19,,,,5,"Petit Pois is all about technique. Great technique and great flavor. Thoughtful. Balanced. Finessed. Let's not forget the attentive great service--experienced and professional. 

Calves liver, Coq au Vin, Cod, French onion soup, arugula, goat cheese and beet salad (which could be constructed to be a predictable and boring pairing--but au contraire, c'est delicieux) plus the tartelette framboise and other well-executed desserts. Where have you been Petit Pois? I don't live in CV but wish I did and will return again and again. 

You tugged at my remembrance of many, many years on the L.A. food scene and also the country French country food scene outside Paris or my favorite cafe in OrlŽans, France. Ah, the proverbial crunchy baguette and the sweet butter--had longed for that ever since moving to the Blueridge. 

Petit Pois you tugged at my heart. Will be grateful and so happy to visit you again. So impressed.",43,,view review
66,,Joyce S.,19/01/20,,,1,5,Wow! The people and the food were amazing. The staff went out of their way to accommodate our group and were so kind and thoughtful throughout the process. I wish I could remember all their names so I could thank them by name because they truly did go above and beyond. We had a wonderful experience and the food was among the best I've had. I highly highly recommend petit pois!,4,103,view review
67,,Sarah E.,30/01/20,,,1,5,"I had dinner here last night with some friends to partake in restaurant week, and I'm so glad we decided to come here! It looked like they were packed with reservations but they so kindly made room for us at the bar. The meal was great from start to finish: the bread, salmon and potato cake, coq au vin, and creme caramel were all delicious and made my taste buds very happy. It looks like the coq au vin is a staple on their regular menu and I would gladly order it again. They also paced the meal very well. I'm already looking forward to coming back- perhaps for a date night or brunch!",14,,view review
68,,Reed R.,01/02/20,,,,5,"My friend and I dined at Petit Pois for lunch and had a good experience. We shared the Moules Marinires (mussels) appetizer, which was outstanding. We then had the trout amandine and smoked lamb ragout, both delicious. For dessert, we shared the ice cream sandwich, which was downed completely. Wine choices are good, as well as the cosy bistro ambience. It will be nice to sit outside on the patio when the weather warms. Service was great.",17,34,view review
69,,Meg N.,09/03/20,1,,1,5,"I spent a summer in Paris and this place is just as phenomenal! I went for restaurant week and got a 3 course meal for $29. I would definitely make reservations since the place is small and intimate. For starters I got the bone marrow and braised oxtail- very rich dish. For my main, I got the Bouillabaisse- seafood was tender and the sauce was decadent! For dessert, I got the flan- average. Would recommend this place for a fancy date!",110,354,view review
70,,Michele M.,09/03/20,,,,5,"Came in (at admittedly a slightly off hour; about 2pm) after seeing the shrimp risotto billed as a lunch special and was delighted! I accompanied it with a light Elderflower soda which has a lovely brisk sensation to it and went along nicely as a light compliment to the very creamy and delicious risotto. The staff was really attentive without being overwhelming or pushy. Can't recommend this place enough! :)

I also got a white chocolate ganache as a dessert; delightful and flavorful, a nice compliment and means to end an already wonderful meal.",11,76,view review
71,,Daphne T.,11/09/20,,,,5,"Oh man this was such a treat! Food was delicious we had the gnocchi with veggies and it was incredible!!! This place is super cute and quaint, and the waitress was very nice and sweet. It's nice sitting outside with the covid going on, next to the water fountain. Loved everything about it. Prices were great too.",42,2,view review
72,,Betty V.,09/10/20,,,,1,"Would never eat here again!  The food was sub standard at best.  I ordered the risotto with shrimp appetizer.  The three small shrimp were tasty but the risotto was bland.  I asked for more Parmesan cheese thinking that would help and was brought a finely grated dish of cheese that had no more flavor than a Kleenex.  The salad was so bitter we could not eat it.  The dressing was unpalatable.  The three pine nuts were not even toasted and the goat cheese was hard, no taste, but thankfully there were only a few crumbs of it.  We complained but they made no effort to remove the dish from our tab.",43,,view review
73,,Keri H.,25/10/20,,,1,5,"Delicious crabcakes for dinner last night and great service, again! Was told we had to wait about 40 minutes for a table to open up after checking in with a few other places on the downtown mall with no openings. It was less than that and we were happy to wait. Food and setting was perfect. Carafe of water and friendly staff. One of our favorite places. Also recommend butternut squash risotto and tomato soup.",57,2,view review
74,,Ale R.,28/10/20,,,,2,I was really disappointed about the quality of the food. The service was really good but the food was mediocre. We had been looking forward to dining here and it was a let down.,72,3,view review
75,,Elizabeth M.,30/10/20,1,,,4,"I'll start with the service at Petit Pois is amazing, they made ordering takeout so easy! The butternut squash risotto was fantastic, but the chicken and basmati rice was a bit underwhelming and lacked some spice. Other than that, the pickup order was easy to place and COVID precaution-friendly. Might have to try again soon.",60,46,view review
76,,Tina L.,07/11/20,,,,5,"Yum, yum, yum. They have a large outdoor seating area due to covid. I got a lovely lovely lovely heirloom tomato salad with lemon aioli, and the co co von. Both were very very good, impressively good. My waiter was awesome too. Great meal.",666,491,view review
77,,Heather W.,24/11/20,,,,5,"Excellent outdoor seating, service and food outstanding.  Wonderful lunch menu and the best soups to keep you warm during dining alfresco.  This establishment has done a superior job to make a safe dining experience.",1,,view review
78,,Lonny F.,31/03/21,,1,1,2,"The food here is below average. Not terrible. The only thing French about this place is the few French words they have on their signage in the bathroom.  Gnocchi is Italian. 

Service is cafe style. For example. They give you a plate with 4 forks, 4 knives and 4 napkins for you to spread out.  That's ok. If you charge prices for a cheap cafe.",45,,view review
79,,John S.,12/04/21,,,,5,"Best lunch in Charlottesville Hands Down. I come here quite a lot and every dish that I have tried has left me satisfied. Big fan of the trout and the butternut squash risotto. The prices relative to other restaurants of similar quality in the area are insane. I wish they were open on Mondays... 

The staff are friendly and always welcome me into the restaurant, I can't say the same for other places.",2,,view review
80,,Val C.,24/04/21,,1,,3,"I went here with my boyfriend to celebrate my birthday. The food was delicious--he got the crabcake and I ended up with the shrimp risotto (more on this later). The risotto was actually an appetizer but at $12 it's a super good deal as it's almost entree-sized. It was decadent and I could taste the parmesan in every bite! I tried a bit of my boyfriend's dish too--the crabcake was a little dry for my taste but overall the dish was good and he seemed to enjoy it a lot.

The service, on the other hand, was a disaster. As in, there was no service. Our server was the only employee working the front of house (there wasn't even a separate host/hostess) and had probably around 10 tables to cover. When we arrived, we waited for about 5 minutes to be seated by the server, which was fine, although the restaurant wasn't crowded at that point so that was a bit odd. I ordered the butternut squash risotto, but in our server's hurry I guess she put in the wrong order and that's how I ended up with an appetizer instead of an entree (although as I said earlier it was excellent so not a huge deal). Our server was nearly running from one table to the next the entire time we were dining, which was stressful to watch and honestly a bit distracting. We were not asked how our meal was once nor were our water glasses refilled despite being empty for 3/4 of the time we were there. Even getting our server's attention for the check was difficult because she would dash inside before we could catch her. 

Overall, the food was fantastic but this was probably the worst service I've had at a restaurant. Petit Pois should think about hiring extra staff or redistributing employee tasks, as they seem to be placing unmanageable responsibilities on their current staff.",14,45,view review
81,,Samantha H.,09/05/21,,,1,5,"This is nestled in a bit of a shadowy corner of downtown, so it never caught my eye, so I am glad I found reviews online that led me here! It was easy to get seated on Saturday lunchtime, and we chose to sit outdoors (we ended up being chilly because it was blustery and out of the sun but the warm food helped).

Between four people, we decided to go family-style with the appetizers of French onion soup, lamb mergeuz soup, and gnocchi. Due to an accident, we got the shrimp risotto (uncharged that we got to keep), and it ended up being one of the best apps. The lamb mergeuz soup was delectable, very unique in flavor and well-balanced in my opinion, bringing a good earthy meaty taste alongside the tender beans and carrots. The French onion soup was done well. While the risotto looked like it had been sitting out for a moment (a bit congealed looking), it tasted phenomenal and was the best risotto I've ever had. It was not overly cheesy or buttery, just perfectly creamy held up by some of the flavor of shrimp. The gnocchi ended up being the weakest app; while the gnocchi were so tender and pillowy, the flavors were confusing, dominated by salt and strangely mingling tangy, herby, and nutty flavors. 

I personally ordered the crab cake and loved my choice. Without excess breading, the crab cake was satisfying and had an excellent flavor including notes of citrus and mustard(?) that went great with the sweet creamed corn -- I was indifferent about the spinach. 

The appetizer portions are very generous! I was so satisfied by this meal and would love to come back again to try other menu items and see how it changes seasonally!",210,24,view review
