,,Author,Date,Cool,Funny,Useful,Rating,Message,Author Reviews,Author Friends,(view source)
1,,Eric C.,29/12/08,,2,2,4,"This is an excellent restaurant right on main street in downtown Charlottesville.  The food was excellent and very well priced given the high quality of food you received.  After seeing how delicious the dinners of those around me looked, I went out on a limb and ordered a dish with spinach (I normally despise it) and I ended up polishing it off.

I went in the winter time so it was a bit cramped inside.  I can definitely see the potential for it in the warmer months though.

-1 star for the fact that our waitress broke the cork while opening our bottle of wine.  I know she was trying hard, but she still assured us that it was okay only to pour a glass, have cork in it, and not even notice.  To not be a jerk, I only asked for a replacement first glass, which she agreed to, but the one that she brought was clearly less full than the original one poured.

Note:  Though the restaurant name means peas...  I inquired and there seemed to be no secret pea recipe they had, so I didn't bother to try them.  My friend did and she thought they were good (but not mind blowing)

Overall I definitely will make a return trip if I'm in the mood for great french food next time I'm in Charlottesville!",62,8,view review
2,,Jessica M.,28/07/09,1,,1,4,"Ate outside at Petit Pois beside Senator Warner and Professor Larry Sabato (you know its gotta be good if the politico big wigs in Cville hit it up) and had a great meal. The cheese plate was great and the bread was fantastic - crusty on the outside, moist and rich on the inside.
I got the risotto with asparagus and roasted tomatoes and it was pretty good, although I think it could use some more flavor.
I'll definitely be there again and I've heard the mac and cheese is great (it wasnt on the menu the night I went)",53,381,view review
3,,John M.,23/05/10,,,1,3,"Visited this restaurant while we were walking around downtown - wanted a small bite before dinner and heard good things from the owners of the B&B where we were staying.

Decided to get the snail appetizer - ever since we had them for the first time in Chicago at Le Creperie we've been into it, and figured we'd try theirs.  I had a beer as it was warm out and we weren't feeling the wine (French heavy list with some local stuff, etc.).  The server was very friendly and helpful, but the Escargot was only OK.  Both places we've been to in Chicago had better, and honestly I expected a bit more from the place.

Great outdoor seating, although during a windy day beware the falling branches, etc....",273,68,view review
4,,Tomu F.,26/07/10,,,1,3,"Came here for lunch on a Saturday.

We started with the mussels appetizer. Nothing really special to it, but I liked it. Some of the mussels tasted a bit raw, but I'm not sure if that's how it's supposed to taste or if it was undercooked. The white wine broth went well with the bread that they served us.

My girlfriend had the tuna entree, which was pretty bland, and honestly, not great at all. It was basically seared tuna on top of a salad with vinegar dressing. Portion was very small as well. I had the veal entree. The portion was small, again, but the meat was soft and went well with the creamy potatoes.

I would give them 2-stars, but service was good and I liked the outside seating right beside the fountain. hence 3-stars.",4,72,view review
5,,Joe B.,17/09/10,,,,4,"Had a lovely Labor Day lunch here. It has a great ambiance and really friendly waitstaff.

Everyone was very happy with their meal I loved my Seared Hanger Steak with shallots, fries, and herb butter.",15,87,view review
6,,Jelena W.,04/07/11,1,,2,5,"Open for lunch on the 4th of July, serving Polyface Farms chicken, and an incredible chocolate mousse to split with my notoriously chocoholic auntie... what could be better? 

We were three for lunch, all fairly picky after having a delicious dinner at a wedding the previous night, and all three sampled each entree ordered and declared them universally delicious. Red wine chicken, onion tart, and (mine) tuna nicoise over mixed greens, followed by a honey tart and chocolate mousse for dessert... not a clunker in the meal.

I usually don't give five star reviews just on principle, but honestly the food couldn't have been better. Waitservice was a touch slow, but excusably so on a holiday. And as we left, the chef happened to be coming back inside from a stroll and stopped to tell us about their ingredients. If I'm ever back to Charlottesville I'll eat here again.",307,353,view review
7,,Holly G.,16/04/12,,,,4,"It was a beautiful day in historic downtown Charlottesville so we decided to sit outside for lunch.  Large trees all around make for a pleasant atmosphere.  (We took a peek inside the restaurant and were not impressed.)  

The beer and wine list is very short but adequate for lunch.  I had the pinot noir while my husband decided to experiment with beers - first with a chocolate milk flavored one then one with a more regular milk flavor.  I'm not a beer person but he says the second one was better.

We both started with the French onion soup.  It was okay but for the price I  (around $9) was expecting something a little more flavorful.  Also, it definitely could have been hotter.  

For the main course, my husband ordered the crab cake and I ordered the beet risotto.  Both were tasty but we both preferred the risotto.

We were too stuffed to even think about dessert.

All in all, a nice dining experience.",75,,view review
8,,Jennifer C.,17/06/12,,,,4,"The food was very good. We ordered Thr snails, which came with about 7 of them. Good sauce. Not enough sauce to dip with. Asparagus with prosciutto was smokey. Not my favorite. French onion soup was cheesy and delicious. Crabcake had a lot of crab. Recommend the Provenal stew, especially good with their perfectly crusty bread.",174,138,view review
9,,Richard S.,11/01/13,,,,4,"Surprised I didn't know about this place, but I have to say I was again surprised. My rating is probably closer to a 3.5, but I'll be nice and round up.

The food was simple and clean, which was good. The only caveat is that I thought it was kinda pricey for what I was getting; fortunately I'd probably still come here again.",79,26,view review
10,,Julia R.,31/03/13,,,2,5,"Fleurie's little sibling! We love Fleurie but only go for birthdays as it is over our budget otherwise. We just adore Petit Pois. I've had brunch here - which was delicious. I've also been here half a dozen times or more for dinner with friends or family. Everyone has always loved it, even if it is a tad on the expensive side. You get what you pay for!!!

I think we've tried everything on the menu. My boyfriend adores the roast chicken, we're both big fans of the hanger steak and fries and French onion soup, and I love the crab cakes. The chocolate mousse is delicious too! 

Truly everything we've ever had has been top-notch. Highly recommended for a fun date night or a more upscale night out with friends. You won't regret it!",43,16,view review
11,,Carla L.,10/04/13,,,,5,"Every time I'm in town, this is a must stop for me. I always start with an appetizer of steak tartare when I order  but I have yet to see it on the menu. As usual, it was superb. For my daughters main coarse, she ordered the risotto with mushrooms, while I ordered the Beef with root veggies. Knowing how much I love this area to come for a few days stay, I will definitely be coming back here. If something you love isn't on the menu doesn't mean they don't have it, ask the wait staff if they have it, they may just surprise you by saying yes.",300,168,view review
12,,Taylor M.,27/05/13,,,2,3,"I feel like Charlottesville thinks very highly of their food, and this place came strongly recommended. I found it pretty forgettable, though. I had the gnocchi, which was a small portion, and was far from the best I tried while visiting Virginia (Founding Farmers' gnocchi in DC was amazing!). 

The service was good and attentive, and the outdoor seating area is nice on these gorgeous spring days.... but the food was nothing super special and in my opinion, not worth the price.",257,59,view review
13,,Deborah H.,10/08/13,,,1,4,"This is a good place for solid service and variety of lovely dishes.  We had cold pea soup-perfect  for a very warm evening also roasted asparagus which was so good.  Desserts were fine too. 

This is comparable to nice bistro in ny by the way.

One thing is air conditioning was not working in the indoor space so eat outside.",840,105,view review
14,,Michael C.,11/02/14,,,2,4,"I had a pleasant experience at this cozy restaurant; by the end, I was regretting that I hadn't tried this place sooner. Petit Pois serves classic French bistro food and does it well.

With my friend, I tried two appetizers, two entrŽes, and a dessert.

To start, we had escargot and onion soup. The escargot was rich and garlicky from the standard herb butter treatment, but I found that the relative balance of butter versus herb and garlic was slightly off and would have liked to see more of the latter two. The onion soup was somewhat lighter than expected as it didn't have a rich flavor of beef stock as one typically hopes for, but they were really able to coax out a deep onion flavor that made up for it.

To continue, we had the beef short rib and the duck confit. Both came in generous portions. The beef short rib was enjoyable, and the crunchy potato was excellent--soft on the inside and crunchy on the outside. The only criticism I can muster is that the roasted carrots were a bit too sweet and the meat, while not dry, could have been slightly moister. The duck confit was a bit drier but still worked pretty well with the tart accompanying sauce.

To finish, we had the crme caramel (i.e. flan). The citrus and clove sauce was an excellent accompaniment and was well suited to the cold winter day on which we dined.",76,6,view review
15,,Michelle P.,24/02/14,2,,3,4,"My friend and I decided it was high time for a change of pace for dinner and decided we should go a bit upscale.  We settled on Petit  Pois, and I'm glad we did!  

We had a delicious round of appetizers including French Onion Soup and Mussels which were both outstanding.  Afterwards I begrudgingly picked out the steak frites - now, I love steak frites, but they're so often disappointing at places nowadays that I feel like it's a big gamble to order them.  Thank goodness Petit Pois proved me wrong.  I'm not exaggerating even a little when I say it was absolutely the best steak frites I have ever had.  The frites were crispy, full of herbs and flavor, and the steak perfectly done with a deliciously seared crust.  Could not have asked for better.  Went great with a local Lovingston white wine which I really enjoyed.

This place is minuscule inside so make sure you plan accordingly.  Also, the entire place is in the draft zone of the door, which is incredibly annoying. They really should put a curtain or something in place to mitigate the horrible icy breeze that sweeps through the place every time someone enters or exits.  As someone who is chronically cold, that really soured the ambiance.",149,33,view review
16,,Lena M.,04/03/14,,,5,1,"My fiancŽ and I were SO disappointed in this place. From their menu online it appears to be a small and cozy restaurant with delicious French food. 

We were not expecting margarine with stale bread, or tasteless escargots plopped in tepid sauce. My fiancŽ had the duck and I had a pork and beef pasta. The duck was a little dry but otherwise ok. There was too much pasta in my dish, and not enough meat. 

Will not be going back.",10,1,view review
17,,IS Palette S.,29/06/14,1,,2,4,"A sweet memory in Charlottesville's historic downtown open mall:
""As we listened to the water dance, we indulged in our appetizer - thinly cut fries with herb de provance. We sat under a canopy of dancing shadows and light breeze."" 

This is just a bite of our full review..",159,8,view review
18,,Cody Y.,11/08/14,1,1,1,4,"This is a review solely for the drinks at the bar - which were actually pretty great. 

While waiting to get into another restaurant, my group of friends stopped at the very small bar inside. This place is upscale and chic with a very modern design of nice, clean lines and they were growing some grass on the bar (okay that sounds strange but it matches the modern decor). The inside bar was very small and seats only about six.

I ordered the mixed drink of the month, which consisted mostly of lemon and gin (Lemon Thyme?). It was fantastic - a great excuse to drink gin in the summer. The bar has a good selection of beer (mostly local VA beers such as Devil's Backbone and Blue Mountain Brewery), other mixed drinks, and a great wine list. We also ordered the Stinson Vineyards RosŽ, which I highly recommend.

I haven't had the food (yet), but at least the bar was awesome, and you can easily take up the whole thing with a group of friends. The prices are to be expected for the Charlottesville area, and the service was satisfactory.",733,152,view review
19,,Brendan W.,12/03/15,,,3,2,"Would normally give 5 stars, because food and service are usually impeccable, even when ordering food to take back to my office for lunch. Today unfortunately, I got an underseasoned and cold shrimp dish with overcooked frites. None of the usual charming touches: condiments, little box of bread and butter, or even the usual friendliness from inside the restaurant.

I am paying full-service price, leaving a full-service tip, and doing a favor for the restaurant's bottom dollar by leaving a table open in a small space. I wouldn't expect this really unusual service..",13,,view review
20,,Axel R.,26/06/15,,,,3,"Pretty excited about steak tartare... Don't go there for it. Poorly put together and way under seasoned. 
Also got a small salad which was okay. Waiter could not be bothered to put together cocktails for us so we had sparkling water. My wife did like her onion soup which earned this place the third star rather than just getting 2. 
I would not recommend going there unless you really are looking to get average food at a slightly higher than average price.",23,15,view review
21,,Erica S.,09/09/15,2,,1,5,"My husband and I were coming through town while on a road trip and just wanted a really good meal out at a nice place. We got it and then some!  The drinks and food were delicious, and the meal was made even more perfect by our fantastic server, Joellen. She was so passionate and energetic and informative about everything on the menu - and so warm -- she really made our meal.

We started out with drinks - with Joellen introducing us to a kind of wine made for several thousand years in the country of Georgia. I wasn't sure if it was what I wanted with my meal, so Joellen brought a bit for me and my husband to try.  It was lovely and interesting but not what I wanted with my dinner. But...I wasn't sure what I wanted, so after I selected my meal (with some help from her -- providing details on various dishes), Joellen offered to provide a selection of suitable pairings. She brought two white wines which she also was knowledgeable about. I tasted them both and instantly selected one to go with my fish.

We  had the chicken liver pate appetizer - the chicken is from a local farm, as are many of their ingredients. It was a mix of amazing flavors and spices and came with these perfectly buttery, toasted bread crisps. The combination was amazing.

Then my husband had the lamb meatballs and  I had the trout almondine. We both loved our dishes. The combination of flavors and elements...just lovely.

We ate outside, overlooking the fountain in the center of the pedestrian ""mall"" in Charlottesville, watching all the people enjoying the warm evening.

With all the great food in this great little city, it seems we could not have gone wrong eating out anywhere here, but we sure are happy we found this french bistro - charming and incredibly knowledgeable staff, lovely setting, delicious and thoughtful food.",27,1,view review
22,,KD M.,22/10/15,1,1,1,5,"An afternoon stroll..
A signboard. Steak frites. Yes please.
Quail, steak, wine. 
Sunshine. People watching from the courtyard. Service by Chris. Priceless.",31,7,view review
23,,Scott R.,05/01/16,,,,5,"Ate here with 4 people in toto. Two had lamb meatballs, another salad, another chicken. Everyone enjoyed the food. Finished with the beignets which were light - and just right for 4. 

Went back the next day for lunch and had a frittata. If you go back the next day then you know it's good.",5,17,view review
24,,Tri L.,09/02/16,,,2,4,"Small space, moderately pricey, approachable french food, and good service.  Overall an enjoyable place to dine.

They have wine bottles on their menu in the $20-range which is a nice surprise.  Menu changes occasionally, though the steak-frites are a standard and are quite delicious.  Steak is cooked well and surprisingly tender while the fries are just awesome.  Like, eat the whole plate and order another side awesome.  Sure you'll feel terrible after doing this but whatever.

The other food has been hit or miss, lamb meatballs were pretty good, some chicken dish was also pretty good.  Some of the sides that come with the main dishes are underwhelming.

Steak-frites gets 5 stars.  Everything else in the 3-4 star range, including the service which was fine but not exceptional.  Bonus points for cheap bottles of wine.  Outdoor seating is great in nice weather, but the service slows down as these tables effectively double the size of the restaurant.",117,6,view review
25,,Kelly T.,12/03/16,1,,,5,"Let me tell you about the simply amazing meal at petit pois. My husband, mother-in-law and I sat on the patio. We got an amazing deal- bringing a bottle of virginia wine- the corking fee is only 10$ according to the website. (And if you're like us once you pop you just don't stop.) Anyhow! the patio was lovely that Thursday evening. You couldn't pick from the menu everything looked so good. My husband's beef was so good- my duck was awesome- I love the sauces are unique and delicious. I've had everything on the menu and everything makes you wish you could eat there every weekend.

This review is really service- Joella was charming. We felt really well taken care off. Petit Pois is really the best of both worlds- delicious food, great service in a bistro atmosphere you don't have to put on uncomfortable clothes for.",47,237,view review
26,,Yasuyo T.,27/03/16,1,,1,4,It is a small restaurant at downtown Charlottesville. The service was great. The portion was pretty good. I had trout. It was nicely seasoned and cooked. I would say that nothing was special but it was not bad for the price.,427,19,view review
27,,Tiffany N.,02/06/16,,,,4,"The food was absolutely delicious! Great wine selection too! The meal lived up to our high expectations for our anniversary.

I wish we could have sat outdoors, but it was a rainy night. The indoor ambiance was a little lacking. I didn't realize it was aiming for a bistro feel...I was expecting a little more upscale interior. It was also pretty dead on a Tuesday evening. It might be more lively on a weekend.",95,4,view review
28,,Kasey L.,19/06/16,1,1,4,3,"We were pretty charmed by Petit Pois' outdoor seating on a breezy Saturday evening in June. Four of us were easily able to get a table around 8:00. The restaurant gives off a healthy, fresh vibe with all the pea and wheatgrass decorations. 

The service was pretty mediocre. The hostess spilled water all over my leg/foot while trying to accomplish a cool pouring maneuver. Our waiter was nice and very efficient, but he wasn't super conversational or warm. The food was really just OK, too. The bread and butter before the meal was super generic. I ordered a steak (which our waiter recommended as ""the best steak in Charlottesville""), and it was so-so. It was cooked as I requested, but the quality of the meat wasn't what I was expecting. It did have a nice herby sauce! It was served with half a plate of shoestring fries which were tasty. I wish there had been some homemade ketchup instead of a commercial brand. I tried my husband's risotto, and it was bland and definitely undercooked. It had a ton of gorgeous fresh vegetables, but it desperately needed more flavor. Our two dining companions felt equally ""meh"" about their entrees. For the two of us, it was close to $60, so we didn't feel like it was worth it (maybe more of a 2.5 star experience). I'm not sure if I'll go back in the future.",377,137,view review
29,,Ryan L.,20/06/16,1,,,2,"My wife just rated this with a generous 3, but I'll review it myself without reading hers because I don't think this restaurant was A-Okay.

The positives:
-At 8 on a Saturday there was plenty of space on their outdoor patio. We didn't have to wait at all.
-Plenty of good people watching from our seats.

The negatives (from myself and the other two visitors who are not my wife):
-Undercooked risotto. It was crunchy. The chef could have figured this out if he'd tried it, then added a little more liquid and let it cook a bit longer. (the vegetables were good and fresh though)
-The trout was bland and under seasoned
-The lamb meatballs were thrown on a plate with several other seemingly random components
-The service was lackluster (poured a lot of water on my wife while missing a glass, water glasses sat unfilled regularly, the waiter repeated our decisions right after we ordered and had 2/4 incorrect, and had to come back to make sure he had the orders right (a second time))

I might come back and give it a second try after I've spent some more time in Charlottesville and exhausted a lot of the other options. If you are only passing through I wouldn't waste a meal here though.",212,75,view review
30,,Jack K.,11/02/17,,,,5,"Wow, what a great experience! One of the best meals I've had in a while in a small place right on the downtown mall.

My split pea soup appetizer was very nice, and substantial as well--almost a meal itself. I followed that with one of the better burgers I've eaten in a while--the beef was obviously fresh and high quality.  My daughter enjoyed her coq au vin; she's picky, and the fact that she ate every bite tells me all I need to know.

Petit Pois is a great place for business meetings because the wait staff is so professional. Our waiter was always around when we needed him, but never interrupted our conversation.  He knew the menu as well, and we appreciated his professionalism.",596,,view review
31,,Ashley V.,07/03/17,,,,5,"I came in for restaurant week and felt like their options were pretty good. I had no idea how small the place was (like VERY SMALL). My friend and I sat at the bar which wasn't too bad but definitely wouldn't have worked out if I had come with a larger party. I tried their lobster bisque which was very delicious but a bit heavy in the salt. I also tried their chicken with mashed potatoes which was reallly good and the chicken was very well cooked and juicy on the inside. I also had some dessert but I forgot what I got.... but I remember it being very mediocre. Overall, I loved the restaurant. They had the best service despite the chaos of restaurant week and the limited space they had to maneuver around the place.",196,433,view review
32,,Josh P.,06/05/17,,,,3,"This review is where I wish we could leave half stars.  3 1/2 would be my rating.  Cute little French place in the downtown Charlottesville area.  We ate outside which is a little loud, but the inside of the restaurant is pretty small.  The outdoor seating at least doubles the capacity.  Server was great, very attentive.  Little things bugged me life my knife was not clean, butter was given very sparingly, my lobster bisque while tasty had broken a little.  Over all the food was good, but for as small a place as this is the details are so important.  There were 3 in the party.  Ordered a bottle of wine and a glass of red for my friend. Wine pricing is pretty fair about 100% mark up so about normal.  Trout entrŽe was good, but the sauce while delicious was enough for one filet, but two came on the plate.  Hanger steak was inconsistent.  2 were ordered one was tender and one was not.  Unimpressed with the French onion soup, seemed to lack flavor.  All and all its a cute place in a cool setting, but with a little extra work on details it would be 4 star easy.",245,11,view review
33,,Stephanie T.,10/05/17,,,1,5,"This was our first stop when we returned to Charlottesville for vacation this year. Their menu is simple, fresh, and delicious. I never feel too full, and love having healthy options like the fresh kale salad as an appetizer and my husband had the frisee salad. For lunch I had Trout Amandine, which was flavored with black pepper, capers, and butter. Service was fast and pleasant. We will definitely be heading back for lunch again this week.",9,50,view review
34,,Langdon L.,20/06/17,,,,4,"Very quaint and attractive French bistro on the downtown mall. Limited seating makes it an intimate encounter if they're busy, and they have a large outdoor seating portion slightly removed from the traffic of the downtown mall. The wait staff was professional and were efficient in their service. Their steak frites were recommended, and were quite delicious. The meat was cooked a perfect medium-rare and was complimented with an appropriately large side of fries. I'm looking forward to coming back and trying their french onion soup, and enjoying a cozy winter dinner inside or a beautiful spring/fall evening on their patio.",160,387,view review
